EFF_DATE,DP_NAME,DP_COMPUTER_CODE,ARTCC,ORIG_GROUP,BODY_NAME,TRANSITION_COMPUTER_CODE,TRANSITION_NAME,ROUTE_POINTS,ROUTE_FROM_ORIG_GROUP
11/27/2025,KIAWAH,KIAWA2.LGRHD,ZJX,KJZI/04|09|22|27,LGRHD,KIAWA2.GIPPL,GIPPL TRANSITION,LGRHD GIPPL,KJZI/04|09|22|27 LGRHD GIPPL
11/27/2025,KILNS,KILNS5.KILNS,ZTL,KAKH/03|21 KCLT/18C|18L|18R|36C|36L|36R KEQY KIPJ/05|23 KJQF/02|20 KLKR KRUQ/02|20 KUZA KVUJ,MUNBE-KILNS,KILNS5.AUDII,AUDII TRANSITION,MUNBE LILIC KILNS DURST AUDII,KAKH/03|21 KCLT/18C|18L|18R|36C|36L|36R KEQY KIPJ/05|23 KJQF/02|20 KLKR KRUQ/02|20 KUZA KVUJ MUNBE LILIC KILNS DURST AUDII
11/27/2025,KKIDS,KKIDS1.KKIDS,ZOB,KCLE/06L|06R,JJOSH-KKIDS,KKIDS1.EWC,ELLWOOD CITY TRANSITION,JJOSH CAILA AHMET KKIDS ZAVEE EWC,KCLE/06L|06R JJOSH CAILA AHMET KKIDS ZAVEE EWC
11/27/2025,KKIDS,KKIDS1.KKIDS,ZOB,KCLE/24L|24R,KAYDN-KKIDS,KKIDS1.EWC,ELLWOOD CITY TRANSITION,KAYDN LYYAM GIIAA KKIDS ZAVEE EWC,KCLE/24L|24R KAYDN LYYAM GIIAA KKIDS ZAVEE EWC
11/27/2025,KKIDS,KKIDS1.KKIDS,ZOB,KCLE/06L|06R,JJOSH-KKIDS,KKIDS1.NUSMM,NUSMM TRANSITION,JJOSH CAILA AHMET KKIDS NUSMM,KCLE/06L|06R JJOSH CAILA AHMET KKIDS NUSMM
11/27/2025,KKIDS,KKIDS1.KKIDS,ZOB,KCLE/24L|24R,KAYDN-KKIDS,KKIDS1.NUSMM,NUSMM TRANSITION,KAYDN LYYAM GIIAA KKIDS NUSMM,KCLE/24L|24R KAYDN LYYAM GIIAA KKIDS NUSMM
11/27/2025,KKITY,KKITY5.KKITY,ZFW,KDAL/13L|13R,DRSET-KKITY,KKITY5.ALIAN,ALIAN TRANSITION,DRSET HAYZZ CURLO KKITY RBBIT FUMED ALIAN,KDAL/13L|13R DRSET HAYZZ CURLO KKITY RBBIT FUMED ALIAN
11/27/2025,KKITY,KKITY5.KKITY,ZFW,KDAL/31L|31R,HAYZZ-KKITY,KKITY5.ALIAN,ALIAN TRANSITION,HAYZZ CURLO KKITY RBBIT FUMED ALIAN,KDAL/31L|31R HAYZZ CURLO KKITY RBBIT FUMED ALIAN
11/27/2025,KKITY,KKITY5.KKITY,ZFW,KDAL/13L|13R,DRSET-KKITY,KKITY5.BRHMA,BRHMA TRANSITION,DRSET HAYZZ CURLO KKITY ROOOO RUFFS KATZZ BRHMA,KDAL/13L|13R DRSET HAYZZ CURLO KKITY ROOOO RUFFS KATZZ BRHMA
11/27/2025,KKITY,KKITY5.KKITY,ZFW,KDAL/31L|31R,HAYZZ-KKITY,KKITY5.BRHMA,BRHMA TRANSITION,HAYZZ CURLO KKITY ROOOO RUFFS KATZZ BRHMA,KDAL/31L|31R HAYZZ CURLO KKITY ROOOO RUFFS KATZZ BRHMA
11/27/2025,KKITY,KKITY5.KKITY,ZFW,KDAL/13L|13R,DRSET-KKITY,KKITY5.CIKAN,CIKAN TRANSITION,DRSET HAYZZ CURLO KKITY RBBIT LYNDE WSTEX CIKAN,KDAL/13L|13R DRSET HAYZZ CURLO KKITY RBBIT LYNDE WSTEX CIKAN
11/27/2025,KKITY,KKITY5.KKITY,ZFW,KDAL/31L|31R,HAYZZ-KKITY,KKITY5.CIKAN,CIKAN TRANSITION,HAYZZ CURLO KKITY RBBIT LYNDE WSTEX CIKAN,KDAL/31L|31R HAYZZ CURLO KKITY RBBIT LYNDE WSTEX CIKAN
11/27/2025,KKITY,KKITY5.KKITY,ZFW,KDAL/13L|13R,DRSET-KKITY,KKITY5.DOSXX,DOSXX TRANSITION,DRSET HAYZZ CURLO KKITY RBBIT LYNDE WSTEX DOSXX,KDAL/13L|13R DRSET HAYZZ CURLO KKITY RBBIT LYNDE WSTEX DOSXX
11/27/2025,KKITY,KKITY5.KKITY,ZFW,KDAL/31L|31R,HAYZZ-KKITY,KKITY5.DOSXX,DOSXX TRANSITION,HAYZZ CURLO KKITY RBBIT LYNDE WSTEX DOSXX,KDAL/31L|31R HAYZZ CURLO KKITY RBBIT LYNDE WSTEX DOSXX
11/27/2025,KKITY,KKITY5.KKITY,ZFW,KDAL/13L|13R,DRSET-KKITY,KKITY5.HUDAD,HUDAD TRANSITION,DRSET HAYZZ CURLO KKITY PGLET MUTEE HUDAD,KDAL/13L|13R DRSET HAYZZ CURLO KKITY PGLET MUTEE HUDAD
11/27/2025,KKITY,KKITY5.KKITY,ZFW,KDAL/31L|31R,HAYZZ-KKITY,KKITY5.HUDAD,HUDAD TRANSITION,HAYZZ CURLO KKITY PGLET MUTEE HUDAD,KDAL/31L|31R HAYZZ CURLO KKITY PGLET MUTEE HUDAD
11/27/2025,KKITY,KKITY5.KKITY,ZFW,KDAL/13L|13R,DRSET-KKITY,KKITY5.HULZE,HULZE TRANSITION,DRSET HAYZZ CURLO KKITY TYGGR DBLSS HRPER HULZE,KDAL/13L|13R DRSET HAYZZ CURLO KKITY TYGGR DBLSS HRPER HULZE
11/27/2025,KKITY,KKITY5.KKITY,ZFW,KDAL/31L|31R,HAYZZ-KKITY,KKITY5.HULZE,HULZE TRANSITION,HAYZZ CURLO KKITY TYGGR DBLSS HRPER HULZE,KDAL/31L|31R HAYZZ CURLO KKITY TYGGR DBLSS HRPER HULZE
11/27/2025,KKITY,KKITY5.KKITY,ZFW,KDAL/13L|13R,DRSET-KKITY,KKITY5.WSTEX,WSTEX TRANSITION,DRSET HAYZZ CURLO KKITY RBBIT LYNDE WSTEX,KDAL/13L|13R DRSET HAYZZ CURLO KKITY RBBIT LYNDE WSTEX
11/27/2025,KKITY,KKITY5.KKITY,ZFW,KDAL/31L|31R,HAYZZ-KKITY,KKITY5.WSTEX,WSTEX TRANSITION,HAYZZ CURLO KKITY RBBIT LYNDE WSTEX,KDAL/31L|31R HAYZZ CURLO KKITY RBBIT LYNDE WSTEX
11/27/2025,KLADA,KLADA2.KLADA,ZMA,KMIA/08L|08R|09|12,JAMBA-KLADA,KLADA2.BITAC,BITAC TRANSITION,JAMBA KBOLA KLADA MEDLI BITAC,KMIA/08L|08R|09|12 JAMBA KBOLA KLADA MEDLI BITAC
11/27/2025,KLADA,KLADA2.KLADA,ZMA,KMIA/26L|26R|27|30,KSENO-KLADA,KLADA2.BITAC,BITAC TRANSITION,KSENO COOZY HAMAK LONZO CWEAD KLADA MEDLI BITAC,KMIA/26L|26R|27|30 KSENO COOZY HAMAK LONZO CWEAD KLADA MEDLI BITAC
11/27/2025,KLADA,KLADA2.KLADA,ZMA,KMIA/08L|08R|09|12,JAMBA-KLADA,KLADA2.JAGOR,JAGOR TRANSITION,JAMBA KBOLA KLADA UPACE JAGOR,KMIA/08L|08R|09|12 JAMBA KBOLA KLADA UPACE JAGOR
11/27/2025,KLADA,KLADA2.KLADA,ZMA,KMIA/26L|26R|27|30,KSENO-KLADA,KLADA2.JAGOR,JAGOR TRANSITION,KSENO COOZY HAMAK LONZO CWEAD KLADA UPACE JAGOR,KMIA/26L|26R|27|30 KSENO COOZY HAMAK LONZO CWEAD KLADA UPACE JAGOR
11/27/2025,KLADA,KLADA2.KLADA,ZMA,KMIA/08L|08R|09|12,JAMBA-KLADA,KLADA2.RAJAY,RAJAY TRANSITION,JAMBA KBOLA KLADA ELQUE RAJAY,KMIA/08L|08R|09|12 JAMBA KBOLA KLADA ELQUE RAJAY
11/27/2025,KLADA,KLADA2.KLADA,ZMA,KMIA/26L|26R|27|30,KSENO-KLADA,KLADA2.RAJAY,RAJAY TRANSITION,KSENO COOZY HAMAK LONZO CWEAD KLADA ELQUE RAJAY,KMIA/26L|26R|27|30 KSENO COOZY HAMAK LONZO CWEAD KLADA ELQUE RAJAY
11/27/2025,KLSHN,KLSHN2.KLSHN,ZVR,KBLI/16|34,KIENO-KLSHN,,,KIENO DNHRT KLSHN,KBLI/16|34 KIENO DNHRT KLSHN
11/27/2025,KLAWOCK,KLWCK1.UDENE,ZAN,PAKW/20,AKCOW-UDENE,,,AKCOW UDENE,PAKW/20 AKCOW UDENE
11/27/2025,KNOST,KNOST2.KNOST,ZMA,KTPA/01L|01R|10|28,WOBAD-KNOST,KNOST2.CIGAR,CIGAR TRANSITION,WOBAD LOREC KNOST CIGAR,KTPA/01L|01R|10|28 WOBAD LOREC KNOST CIGAR
11/27/2025,KNOST,KNOST2.KNOST,ZMA,KTPA/01L|01R|10|28,WOBAD-KNOST,KNOST2.REMIS,REMIS TRANSITION,WOBAD LOREC KNOST REMIS,KTPA/01L|01R|10|28 WOBAD LOREC KNOST REMIS
11/27/2025,KNURL,KNURL1.KNURL,ZLC,KPIH/03|17|21|35,KNURL,,,KNURL,KPIH/03|17|21|35 KNURL
11/27/2025,KREST,KREST3.KREST,ZOA,KRDD/12|16|30|34,KREST,KREST3.ITMOR,ITMOR TRANSITION,KREST ITMOR,KRDD/12|16|30|34 KREST ITMOR
11/27/2025,KREST,KREST3.KREST,ZOA,KRDD/12|16|30|34,KREST,KREST3.SHATA,SHATA TRANSITION,KREST SHATA,KRDD/12|16|30|34 KREST SHATA
11/27/2025,KREST,KREST3.KREST,ZOA,KRDD/12|16|30|34,KREST,KREST3.TOMAD,TOMAD TRANSITION,KREST SHATA SIPJY TOMAD,KRDD/12|16|30|34 KREST SHATA SIPJY TOMAD
11/27/2025,KRITR,KRITR6.KRITR,ZTL,KAKH/03|21 KCLT/18C|18L|18R|36C|36L|36R KEQY KIPJ/05|23 KJQF/02|20 KLKR KRUQ/02|20 KUZA KVUJ,JDEAN-KRITR,KRITR6.FILDS,FILDS TRANSITION,JDEAN KRITR FILDS,KAKH/03|21 KCLT/18C|18L|18R|36C|36L|36R KEQY KIPJ/05|23 KJQF/02|20 KLKR KRUQ/02|20 KUZA KVUJ JDEAN KRITR FILDS
11/27/2025,KRITR,KRITR6.KRITR,ZTL,KAKH/03|21 KCLT/18C|18L|18R|36C|36L|36R KEQY KIPJ/05|23 KJQF/02|20 KLKR KRUQ/02|20 KUZA KVUJ,JDEAN-KRITR,KRITR6.SMIAM,SMIAM TRANSITION,JDEAN KRITR SMIAM,KAKH/03|21 KCLT/18C|18L|18R|36C|36L|36R KEQY KIPJ/05|23 KJQF/02|20 KLKR KRUQ/02|20 KUZA KVUJ JDEAN KRITR SMIAM
11/27/2025,KRMSN,KRMSN4.KRMSN,ZFW,KOKC/13|17L|17R|18|31|35L|35R|36 KOUN/03|18|21|36 KPWA/13|17L|17R|31|35L|35R,SWTZR-KRMSN,KRMSN4.WICKS,WICKS TRANSITION,SWTZR KRMSN WICKS,KOKC/13|17L|17R|18|31|35L|35R|36 KOUN/03|18|21|36 KPWA/13|17L|17R|31|35L|35R SWTZR KRMSN WICKS
11/27/2025,KRSTA,KRSTA4.KRSTA,ZME,KBNA/20C|20L|20R,BUBYY-KRSTA,KRSTA4.OLSIE,OLSIE TRANSITION,BUBYY MEMMY JAEXX CERAH KRSTA OLSIE,KBNA/20C|20L|20R BUBYY MEMMY JAEXX CERAH KRSTA OLSIE
11/27/2025,KRSTA,KRSTA4.KRSTA,ZME,KBNA/13|31,CERAH-KRSTA,KRSTA4.OLSIE,OLSIE TRANSITION,CERAH KRSTA OLSIE,KBNA/13|31 CERAH KRSTA OLSIE
11/27/2025,KRSTA,KRSTA4.KRSTA,ZME,KBNA/02C|02L|02R,JATII-KRSTA,KRSTA4.OLSIE,OLSIE TRANSITION,JATII CERAH KRSTA OLSIE,KBNA/02C|02L|02R JATII CERAH KRSTA OLSIE
11/27/2025,KRUMM,KRUMM1.FUZ,ZFW,KDAL/13R,FUZ,KRUMM1.ADM,ARDMORE TRANSITION,FUZ LOWGN ADM,KDAL/13R FUZ LOWGN ADM
11/27/2025,KRUMM,KRUMM1.FUZ,ZFW,KDAL/13R,FUZ,KRUMM1.BLECO,BLECO TRANSITION,FUZ BLECO,KDAL/13R FUZ BLECO
11/27/2025,KRUMM,KRUMM1.FUZ,ZFW,KDAL/13R,FUZ,KRUMM1.EAKER,EAKER TRANSITION,FUZ GRABE EAKER,KDAL/13R FUZ GRABE EAKER
11/27/2025,KRUMM,KRUMM1.FUZ,ZFW,KDAL/13R,FUZ,KRUMM1.GRABE,GRABE TRANSITION,FUZ GRABE,KDAL/13R FUZ GRABE
11/27/2025,KRUMM,KRUMM1.FUZ,ZFW,KDAL/13R,FUZ,KRUMM1.IRW,WILL ROGERS TRANSITION,FUZ BLECO ZEMMA IRW,KDAL/13R FUZ BLECO ZEMMA IRW
11/27/2025,KRUMM,KRUMM1.FUZ,ZFW,KDAL/13R,FUZ,KRUMM1.OKM,OKMULGEE TRANSITION,FUZ GRABE EAKER OKM,KDAL/13R FUZ GRABE EAKER OKM
11/27/2025,KRUMM,KRUMM1.FUZ,ZFW,KDAL/13R,FUZ,KRUMM1.ROLLS,ROLLS TRANSITION,FUZ LOWGN ADM ROLLS,KDAL/13R FUZ LOWGN ADM ROLLS
11/27/2025,KRUMM,KRUMM1.FUZ,ZFW,KDAL/13R,FUZ,KRUMM1.TUL,TULSA TRANSITION,FUZ BLECO ZEMMA TUL,KDAL/13R FUZ BLECO ZEMMA TUL
11/27/2025,KRUMM,KRUMM1.FUZ,ZFW,KDAL/13R,FUZ,KRUMM1.ZEMMA,ZEMMA TRANSITION,FUZ BLECO ZEMMA,KDAL/13R FUZ BLECO ZEMMA
11/27/2025,KSHEE,KSHEE5.KSHEE,ZKC,KSTL/29,DSAPP-KSHEE,KSHEE5.LEBOY,LEBOY TRANSITION,DSAPP CONRR KSHEE LEBOY,KSTL/29 DSAPP CONRR KSHEE LEBOY
11/27/2025,KSHEE,KSHEE5.KSHEE,ZKC,KSTL/11|12L|12R,FUNKE-KSHEE,KSHEE5.LEBOY,LEBOY TRANSITION,FUNKE BEART GMSKI KSHEE LEBOY,KSTL/11|12L|12R FUNKE BEART GMSKI KSHEE LEBOY
11/27/2025,KSHEE,KSHEE5.KSHEE,ZKC,KSTL/06|24,KSHEE,KSHEE5.LEBOY,LEBOY TRANSITION,KSHEE LEBOY,KSTL/06|24 KSHEE LEBOY
11/27/2025,KSHEE,KSHEE5.KSHEE,ZKC,KSTL/30L|30R,WOLTR-KSHEE,KSHEE5.LEBOY,LEBOY TRANSITION,WOLTR CONRR KSHEE LEBOY,KSTL/30L|30R WOLTR CONRR KSHEE LEBOY
11/27/2025,KSHEE,KSHEE5.KSHEE,ZKC,KSTL/29,DSAPP-KSHEE,KSHEE5.SEXTN,SEXTN TRANSITION,DSAPP CONRR KSHEE LEBOY SEXTN,KSTL/29 DSAPP CONRR KSHEE LEBOY SEXTN
11/27/2025,KSHEE,KSHEE5.KSHEE,ZKC,KSTL/11|12L|12R,FUNKE-KSHEE,KSHEE5.SEXTN,SEXTN TRANSITION,FUNKE BEART GMSKI KSHEE LEBOY SEXTN,KSTL/11|12L|12R FUNKE BEART GMSKI KSHEE LEBOY SEXTN
11/27/2025,KSHEE,KSHEE5.KSHEE,ZKC,KSTL/06|24,KSHEE,KSHEE5.SEXTN,SEXTN TRANSITION,KSHEE LEBOY SEXTN,KSTL/06|24 KSHEE LEBOY SEXTN
11/27/2025,KSHEE,KSHEE5.KSHEE,ZKC,KSTL/30L|30R,WOLTR-KSHEE,KSHEE5.SEXTN,SEXTN TRANSITION,WOLTR CONRR KSHEE LEBOY SEXTN,KSTL/30L|30R WOLTR CONRR KSHEE LEBOY SEXTN
11/27/2025,BREVIG,KTS3.MUJUD,ZAN,PFKT/12|23|30,MUJUD,,,MUJUD,PFKT/12|23|30 MUJUD
11/27/2025,BERMUDA DUNES,KUDD1.KUDD,ZLA,KUDD/10|28,TRM,,,TRM,KUDD/10|28 TRM
11/27/2025,KUMBA,KUMBA1.KUMBA,ZLA,L08/08,CELOP-KUMBA,,,CELOP HETMA KUMBA,L08/08 CELOP HETMA KUMBA
11/27/2025,KUMBA,KUMBA1.KUMBA,ZLA,L08/26,HORGA-KUMBA,,,HORGA CEMBI HETMA KUMBA,L08/26 HORGA CEMBI HETMA KUMBA
11/27/2025,KUSSO,KUSSO1.KUSSO,ZFW,50F/17 F41 F46 KADS KAFW/16R KCPT KDAL/13L|13R|31L|31R KDFW/13L|13R|17C|17L|17R|18L|18R|31L|31R|35C|35L|35R|36L|36R KDTO KFTW/16|17 KFWS/18R KGKY/16|34 KGPM/18 KHQZ KJWY/18|36 KLNC/31 KLUD/17 KNFW KRBD/13|17|31|35 KTKI KWEA/35,SALVE-KUSSO,KUSSO1.BDDAY,BDDAY TRANSITION,SALVE KUSSO THHOR JJANE MRSSH BDDAY,50F/17 F41 F46 KADS KAFW/16R KCPT KDAL/13L|13R|31L|31R KDFW/13L|13R|17C|17L|17R|18L|18R|31L|31R|35C|35L|35R|36L|36R KDTO KFTW/16|17 KFWS/18R KGKY/16|34 KGPM/18 KHQZ KJWY/18|36 KLNC/31 KLUD/17 KNFW KRBD/13|17|31|35 KTKI KWEA/35 SALVE KUSSO THHOR JJANE MRSSH BDDAY
11/27/2025,KUSSO,KUSSO1.KUSSO,ZFW,50F/17 F41 F46 KADS KAFW/16R KCPT KDAL/13L|13R|31L|31R KDFW/13L|13R|17C|17L|17R|18L|18R|31L|31R|35C|35L|35R|36L|36R KDTO KFTW/16|17 KFWS/18R KGKY/16|34 KGPM/18 KHQZ KJWY/18|36 KLNC/31 KLUD/17 KNFW KRBD/13|17|31|35 KTKI KWEA/35,SALVE-KUSSO,KUSSO1.BSKAT,BSKAT TRANSITION,SALVE KUSSO ZERLU SWDIA ZACHH BSKAT,50F/17 F41 F46 KADS KAFW/16R KCPT KDAL/13L|13R|31L|31R KDFW/13L|13R|17C|17L|17R|18L|18R|31L|31R|35C|35L|35R|36L|36R KDTO KFTW/16|17 KFWS/18R KGKY/16|34 KGPM/18 KHQZ KJWY/18|36 KLNC/31 KLUD/17 KNFW KRBD/13|17|31|35 KTKI KWEA/35 SALVE KUSSO ZERLU SWDIA ZACHH BSKAT
11/27/2025,KUSSO,KUSSO1.KUSSO,ZFW,50F/17 F41 F46 KADS KAFW/16R KCPT KDAL/13L|13R|31L|31R KDFW/13L|13R|17C|17L|17R|18L|18R|31L|31R|35C|35L|35R|36L|36R KDTO KFTW/16|17 KFWS/18R KGKY/16|34 KGPM/18 KHQZ KJWY/18|36 KLNC/31 KLUD/17 KNFW KRBD/13|17|31|35 KTKI KWEA/35,SALVE-KUSSO,KUSSO1.FORCK,FORCK TRANSITION,SALVE KUSSO HANUH LYING FORCK,50F/17 F41 F46 KADS KAFW/16R KCPT KDAL/13L|13R|31L|31R KDFW/13L|13R|17C|17L|17R|18L|18R|31L|31R|35C|35L|35R|36L|36R KDTO KFTW/16|17 KFWS/18R KGKY/16|34 KGPM/18 KHQZ KJWY/18|36 KLNC/31 KLUD/17 KNFW KRBD/13|17|31|35 KTKI KWEA/35 SALVE KUSSO HANUH LYING FORCK
11/27/2025,KUSSO,KUSSO1.KUSSO,ZFW,50F/17 F41 F46 KADS KAFW/16R KCPT KDAL/13L|13R|31L|31R KDFW/13L|13R|17C|17L|17R|18L|18R|31L|31R|35C|35L|35R|36L|36R KDTO KFTW/16|17 KFWS/18R KGKY/16|34 KGPM/18 KHQZ KJWY/18|36 KLNC/31 KLUD/17 KNFW KRBD/13|17|31|35 KTKI KWEA/35,SALVE-KUSSO,KUSSO1.LOOSE,LOOSE TRANSITION,SALVE KUSSO TRRCH JAYXX TRYTN LOOSE,50F/17 F41 F46 KADS KAFW/16R KCPT KDAL/13L|13R|31L|31R KDFW/13L|13R|17C|17L|17R|18L|18R|31L|31R|35C|35L|35R|36L|36R KDTO KFTW/16|17 KFWS/18R KGKY/16|34 KGPM/18 KHQZ KJWY/18|36 KLNC/31 KLUD/17 KNFW KRBD/13|17|31|35 KTKI KWEA/35 SALVE KUSSO TRRCH JAYXX TRYTN LOOSE
11/27/2025,KUSSO,KUSSO1.KUSSO,ZFW,50F/17 F41 F46 KADS KAFW/16R KCPT KDAL/13L|13R|31L|31R KDFW/13L|13R|17C|17L|17R|18L|18R|31L|31R|35C|35L|35R|36L|36R KDTO KFTW/16|17 KFWS/18R KGKY/16|34 KGPM/18 KHQZ KJWY/18|36 KLNC/31 KLUD/17 KNFW KRBD/13|17|31|35 KTKI KWEA/35,SALVE-KUSSO,KUSSO1.MRSSH,MRSSH TRANSITION,SALVE KUSSO THHOR JJANE MRSSH,50F/17 F41 F46 KADS KAFW/16R KCPT KDAL/13L|13R|31L|31R KDFW/13L|13R|17C|17L|17R|18L|18R|31L|31R|35C|35L|35R|36L|36R KDTO KFTW/16|17 KFWS/18R KGKY/16|34 KGPM/18 KHQZ KJWY/18|36 KLNC/31 KLUD/17 KNFW KRBD/13|17|31|35 KTKI KWEA/35 SALVE KUSSO THHOR JJANE MRSSH
11/27/2025,KUSSO,KUSSO1.KUSSO,ZFW,50F/17 F41 F46 KADS KAFW/16R KCPT KDAL/13L|13R|31L|31R KDFW/13L|13R|17C|17L|17R|18L|18R|31L|31R|35C|35L|35R|36L|36R KDTO KFTW/16|17 KFWS/18R KGKY/16|34 KGPM/18 KHQZ KJWY/18|36 KLNC/31 KLUD/17 KNFW KRBD/13|17|31|35 KTKI KWEA/35,SALVE-KUSSO,KUSSO1.ZALEA,ZALEA TRANSITION,SALVE KUSSO THHOR JJANE MRSSH ZALEA,50F/17 F41 F46 KADS KAFW/16R KCPT KDAL/13L|13R|31L|31R KDFW/13L|13R|17C|17L|17R|18L|18R|31L|31R|35C|35L|35R|36L|36R KDTO KFTW/16|17 KFWS/18R KGKY/16|34 KGPM/18 KHQZ KJWY/18|36 KLNC/31 KLUD/17 KNFW KRBD/13|17|31|35 KTKI KWEA/35 SALVE KUSSO THHOR JJANE MRSSH ZALEA
11/27/2025,KWANG,KWANG6.KWANG,ZLA,KSBA/07|15L|15R|25,KWANG,KWANG6.GINNA,GINNA TRANSITION,KWANG CMA GINNA,KSBA/07|15L|15R|25 KWANG CMA GINNA
11/27/2025,KWANG,KWANG6.KWANG,ZLA,KSBA/07|15L|15R|25,KWANG,KWANG6.HENER,HENER TRANSITION,KWANG HENER,KSBA/07|15L|15R|25 KWANG HENER
11/27/2025,KWANG,KWANG6.KWANG,ZLA,KSBA/07|15L|15R|25,KWANG,KWANG6.RZS,SAN MARCUS TRANSITION,KWANG RZS,KSBA/07|15L|15R|25 KWANG RZS
11/27/2025,KWEEN,KWEEN5.KWEEN,ZTL,KAKH/03|21 KCLT/18C|18L|18R|36C|36L|36R KEQY KIPJ/05|23 KJQF/02|20 KLKR KRUQ/02|20 KUZA KVUJ,HMMPY-KWEEN,KWEEN5.PITRW,PITRW TRANSITION,HMMPY KWEEN UNJAM TASTY PITRW,KAKH/03|21 KCLT/18C|18L|18R|36C|36L|36R KEQY KIPJ/05|23 KJQF/02|20 KLKR KRUQ/02|20 KUZA KVUJ HMMPY KWEEN UNJAM TASTY PITRW
11/27/2025,KWEEN,KWEEN5.KWEEN,ZTL,KAKH/03|21 KCLT/18C|18L|18R|36C|36L|36R KEQY KIPJ/05|23 KJQF/02|20 KLKR KRUQ/02|20 KUZA KVUJ,HMMPY-KWEEN,KWEEN5.UNJAM,UNJAM TRANSITION,HMMPY KWEEN UNJAM,KAKH/03|21 KCLT/18C|18L|18R|36C|36L|36R KEQY KIPJ/05|23 KJQF/02|20 KLKR KRUQ/02|20 KUZA KVUJ HMMPY KWEEN UNJAM
11/27/2025,KYLOW,KYLOW1.KYLOW,ZLA,KLAX/24L|24R,DSTAR-KYLOW,KYLOW1.DINTY,DINTY TRANSITION,DSTAR KYLOW BOBAA FIXIT RIZIN OINGO DINTY,KLAX/24L|24R DSTAR KYLOW BOBAA FIXIT RIZIN OINGO DINTY
11/27/2025,KYLOW,KYLOW1.KYLOW,ZLA,KLAX/25L|25R,EWOKK-KYLOW,KYLOW1.DINTY,DINTY TRANSITION,EWOKK KYLOW BOBAA FIXIT RIZIN OINGO DINTY,KLAX/25L|25R EWOKK KYLOW BOBAA FIXIT RIZIN OINGO DINTY
11/27/2025,KYLOW,KYLOW1.KYLOW,ZLA,KLAX/24L|24R,DSTAR-KYLOW,KYLOW1.FICKY,FICKY TRANSITION,DSTAR KYLOW ZILLI LAUER PLLUT DUNZL IGOTT FICKY,KLAX/24L|24R DSTAR KYLOW ZILLI LAUER PLLUT DUNZL IGOTT FICKY
11/27/2025,KYLOW,KYLOW1.KYLOW,ZLA,KLAX/25L|25R,EWOKK-KYLOW,KYLOW1.FICKY,FICKY TRANSITION,EWOKK KYLOW ZILLI LAUER PLLUT DUNZL IGOTT FICKY,KLAX/25L|25R EWOKK KYLOW ZILLI LAUER PLLUT DUNZL IGOTT FICKY
11/27/2025,KYLOW,KYLOW1.KYLOW,ZLA,KLAX/24L|24R,DSTAR-KYLOW,KYLOW1.GROGU,GROGU TRANSITION,DSTAR KYLOW ZILLI BEAUT RIFFT MALIT GROGU,KLAX/24L|24R DSTAR KYLOW ZILLI BEAUT RIFFT MALIT GROGU
11/27/2025,KYLOW,KYLOW1.KYLOW,ZLA,KLAX/25L|25R,EWOKK-KYLOW,KYLOW1.GROGU,GROGU TRANSITION,EWOKK KYLOW ZILLI BEAUT RIFFT MALIT GROGU,KLAX/25L|25R EWOKK KYLOW ZILLI BEAUT RIFFT MALIT GROGU
11/27/2025,KYLOW,KYLOW1.KYLOW,ZLA,KLAX/24L|24R,DSTAR-KYLOW,KYLOW1.MCKEY,MCKEY TRANSITION,DSTAR KYLOW BOBAA FIXIT RIZIN MCKEY,KLAX/24L|24R DSTAR KYLOW BOBAA FIXIT RIZIN MCKEY
11/27/2025,KYLOW,KYLOW1.KYLOW,ZLA,KLAX/25L|25R,EWOKK-KYLOW,KYLOW1.MCKEY,MCKEY TRANSITION,EWOKK KYLOW BOBAA FIXIT RIZIN MCKEY,KLAX/25L|25R EWOKK KYLOW BOBAA FIXIT RIZIN MCKEY
11/27/2025,KYLOW,KYLOW1.KYLOW,ZLA,KLAX/24L|24R,DSTAR-KYLOW,KYLOW1.RIZIN,RIZIN TRANSITION,DSTAR KYLOW BOBAA FIXIT RIZIN,KLAX/24L|24R DSTAR KYLOW BOBAA FIXIT RIZIN
11/27/2025,KYLOW,KYLOW1.KYLOW,ZLA,KLAX/25L|25R,EWOKK-KYLOW,KYLOW1.RIZIN,RIZIN TRANSITION,EWOKK KYLOW BOBAA FIXIT RIZIN,KLAX/25L|25R EWOKK KYLOW BOBAA FIXIT RIZIN
11/27/2025,KYLOW,KYLOW1.KYLOW,ZLA,KLAX/24L|24R,DSTAR-KYLOW,KYLOW1.SCTRR,SCTRR TRANSITION,DSTAR KYLOW BOBAA FIXIT RIZIN TESEA SCTRR,KLAX/24L|24R DSTAR KYLOW BOBAA FIXIT RIZIN TESEA SCTRR
11/27/2025,KYLOW,KYLOW1.KYLOW,ZLA,KLAX/25L|25R,EWOKK-KYLOW,KYLOW1.SCTRR,SCTRR TRANSITION,EWOKK KYLOW BOBAA FIXIT RIZIN TESEA SCTRR,KLAX/25L|25R EWOKK KYLOW BOBAA FIXIT RIZIN TESEA SCTRR
11/27/2025,KYLOW,KYLOW1.KYLOW,ZLA,KLAX/24L|24R,DSTAR-KYLOW,KYLOW1.STOKD,STOKD TRANSITION,DSTAR KYLOW BOBAA FIXIT RIZIN SPLNT STOKD,KLAX/24L|24R DSTAR KYLOW BOBAA FIXIT RIZIN SPLNT STOKD
11/27/2025,KYLOW,KYLOW1.KYLOW,ZLA,KLAX/25L|25R,EWOKK-KYLOW,KYLOW1.STOKD,STOKD TRANSITION,EWOKK KYLOW BOBAA FIXIT RIZIN SPLNT STOKD,KLAX/25L|25R EWOKK KYLOW BOBAA FIXIT RIZIN SPLNT STOKD
11/27/2025,KZLOV,KZLOV2.WINNZ,ZOB,KDTW/03L|03R|04L|04R,BESST-WINNZ,,,BESST SWNDL KZLOV WINNZ,KDTW/03L|03R|04L|04R BESST SWNDL KZLOV WINNZ
11/27/2025,KZLOV,KZLOV2.WINNZ,ZOB,KDTW/21L|21R|22L|22R,JOELU-WINNZ,,,JOELU YIMMY HWARD KZLOV WINNZ,KDTW/21L|21R|22L|22R JOELU YIMMY HWARD KZLOV WINNZ
11/27/2025,KZLOV,KZLOV2.WINNZ,ZOB,KARB/06|24 KDET/15|33 KDTW/27L|27R KMTC/01|19 KONZ/04|17|22|35 KOZW/13|31 KPTK/09L|09R|27L|27R KTTF/03|21 KVLL/10|28 KYIP/09|27,KZLOV-WINNZ,,,KZLOV WINNZ,KARB/06|24 KDET/15|33 KDTW/27L|27R KMTC/01|19 KONZ/04|17|22|35 KOZW/13|31 KPTK/09L|09R|27L|27R KTTF/03|21 KVLL/10|28 KYIP/09|27 KZLOV WINNZ
11/27/2025,CALIFORNIA CITY,L711.LHS,ZLA,L71/06,WIRUS-LHS,,,WIRUS RABME CIRDA UGONE LHS,L71/06 WIRUS RABME CIRDA UGONE LHS
11/27/2025,CALIFORNIA CITY,L711.LHS,ZLA,L71/24,ZUSUR-LHS,,,ZUSUR UGONE LHS,L71/24 ZUSUR UGONE LHS
11/27/2025,LADYJ,LADYJ4.LADYJ,ZLA,KLAX/24L,DLREY-LADYJ,LADYJ4.COREZ,COREZ TRANSITION,DLREY ENNEY EYENO MLIBU LADYJ RUGBY OROSZ BRRKK SHORS MDWAY COREZ,KLAX/24L DLREY ENNEY EYENO MLIBU LADYJ RUGBY OROSZ BRRKK SHORS MDWAY COREZ
11/27/2025,LADYJ,LADYJ4.LADYJ,ZLA,KLAX/25R,DOCKR-LADYJ,LADYJ4.COREZ,COREZ TRANSITION,DOCKR EVOSE MKGEE MLIBU LADYJ RUGBY OROSZ BRRKK SHORS MDWAY COREZ,KLAX/25R DOCKR EVOSE MKGEE MLIBU LADYJ RUGBY OROSZ BRRKK SHORS MDWAY COREZ
11/27/2025,LADYJ,LADYJ4.LADYJ,ZLA,KLAX/24R,FABRA-LADYJ,LADYJ4.COREZ,COREZ TRANSITION,FABRA ENNEY EYENO MLIBU LADYJ RUGBY OROSZ BRRKK SHORS MDWAY COREZ,KLAX/24R FABRA ENNEY EYENO MLIBU LADYJ RUGBY OROSZ BRRKK SHORS MDWAY COREZ
11/27/2025,LADYJ,LADYJ4.LADYJ,ZLA,KLAX/25L,HIIPR-LADYJ,LADYJ4.COREZ,COREZ TRANSITION,HIIPR EVOSE MKGEE MLIBU LADYJ RUGBY OROSZ BRRKK SHORS MDWAY COREZ,KLAX/25L HIIPR EVOSE MKGEE MLIBU LADYJ RUGBY OROSZ BRRKK SHORS MDWAY COREZ
11/27/2025,LADYJ,LADYJ4.LADYJ,ZLA,KLAX/24L,DLREY-LADYJ,LADYJ4.CSTRO,CSTRO TRANSITION,DLREY ENNEY EYENO MLIBU LADYJ RUGBY OROSZ HEYJO CSTRO,KLAX/24L DLREY ENNEY EYENO MLIBU LADYJ RUGBY OROSZ HEYJO CSTRO
11/27/2025,LADYJ,LADYJ4.LADYJ,ZLA,KLAX/25R,DOCKR-LADYJ,LADYJ4.CSTRO,CSTRO TRANSITION,DOCKR EVOSE MKGEE MLIBU LADYJ RUGBY OROSZ HEYJO CSTRO,KLAX/25R DOCKR EVOSE MKGEE MLIBU LADYJ RUGBY OROSZ HEYJO CSTRO
11/27/2025,LADYJ,LADYJ4.LADYJ,ZLA,KLAX/24R,FABRA-LADYJ,LADYJ4.CSTRO,CSTRO TRANSITION,FABRA ENNEY EYENO MLIBU LADYJ RUGBY OROSZ HEYJO CSTRO,KLAX/24R FABRA ENNEY EYENO MLIBU LADYJ RUGBY OROSZ HEYJO CSTRO
11/27/2025,LADYJ,LADYJ4.LADYJ,ZLA,KLAX/25L,HIIPR-LADYJ,LADYJ4.CSTRO,CSTRO TRANSITION,HIIPR EVOSE MKGEE MLIBU LADYJ RUGBY OROSZ HEYJO CSTRO,KLAX/25L HIIPR EVOSE MKGEE MLIBU LADYJ RUGBY OROSZ HEYJO CSTRO
11/27/2025,LAKEPORT,LAKPT3.ENI,ZOA,1O2/10,CEVLA-ENI,,,CEVLA HEBLU ENI,1O2/10 CEVLA HEBLU ENI
11/27/2025,LALUZ,LALUZ6.LALUZ,ZAB,KCHD/04L|04R|22L|22R KDVT/25L|25R KGEU/01|19 KGYR/03|21 KIWA/12C|12L|12R|30C|30L|30R KSDL/03|21,FORPE-LALUZ,LALUZ6.ABQ,ALBUQUERQUE TRANSITION,FORPE LALUZ SJN ABQ,KCHD/04L|04R|22L|22R KDVT/25L|25R KGEU/01|19 KGYR/03|21 KIWA/12C|12L|12R|30C|30L|30R KSDL/03|21 FORPE LALUZ SJN ABQ
11/27/2025,LALUZ,LALUZ6.LALUZ,ZAB,KCHD/04L|04R|22L|22R KDVT/25L|25R KGEU/01|19 KGYR/03|21 KIWA/12C|12L|12R|30C|30L|30R KSDL/03|21,FORPE-LALUZ,LALUZ6.MAXXO,MAXXO TRANSITION,FORPE LALUZ SJN JSSUA MAXXO,KCHD/04L|04R|22L|22R KDVT/25L|25R KGEU/01|19 KGYR/03|21 KIWA/12C|12L|12R|30C|30L|30R KSDL/03|21 FORPE LALUZ SJN JSSUA MAXXO
11/27/2025,LALUZ,LALUZ6.LALUZ,ZAB,KCHD/04L|04R|22L|22R KDVT/25L|25R KGEU/01|19 KGYR/03|21 KIWA/12C|12L|12R|30C|30L|30R KSDL/03|21,FORPE-LALUZ,LALUZ6.SJN,ST JOHNS TRANSITION,FORPE LALUZ SJN,KCHD/04L|04R|22L|22R KDVT/25L|25R KGEU/01|19 KGYR/03|21 KIWA/12C|12L|12R|30C|30L|30R KSDL/03|21 FORPE LALUZ SJN
11/27/2025,LAMON,LAMON4.LAMON,ZLC,KDIJ/04|22,LAMON,,,LAMON,KDIJ/04|22 LAMON
11/27/2025,LARAMIE,LAR1.LAR,ZDV,KLAR/03|12|21|30,LAR,,,LAR,KLAR/03|12|21|30 LAR
11/27/2025,LATVE,LATVE3.LATVE,ZAB,KELP/22|26L,AKADE-LATVE,LATVE3.CME,CHISUM TRANSITION,AKADE HIKEM CATEG LATVE AKASE BLRNG RIICK CME,KELP/22|26L AKADE HIKEM CATEG LATVE AKASE BLRNG RIICK CME
11/27/2025,LATVE,LATVE3.LATVE,ZAB,KELP/04,KERGE-LATVE,LATVE3.CME,CHISUM TRANSITION,KERGE DOTGE LATVE AKASE BLRNG RIICK CME,KELP/04 KERGE DOTGE LATVE AKASE BLRNG RIICK CME
11/27/2025,LATVE,LATVE3.LATVE,ZAB,KELP/08R,MATLE-LATVE,LATVE3.CME,CHISUM TRANSITION,MATLE CATEG LATVE AKASE BLRNG RIICK CME,KELP/08R MATLE CATEG LATVE AKASE BLRNG RIICK CME
11/27/2025,LAVAA,LAVAA7.LAVAA,ZSE,KPDX/28L|28R,PEGTY-LAVAA,LAVAA7.PDT,PENDLETON TRANSITION,PEGTY KELYY ARUPT LAVAA PDT,KPDX/28L|28R PEGTY KELYY ARUPT LAVAA PDT
11/27/2025,LAVAA,LAVAA7.LAVAA,ZSE,KPDX/10L|10R,RIVRR-LAVAA,LAVAA7.PDT,PENDLETON TRANSITION,RIVRR COSUG OKKOR LAVAA PDT,KPDX/10L|10R RIVRR COSUG OKKOR LAVAA PDT
11/27/2025,LAVAA,LAVAA7.LAVAA,ZSE,KPDX/28L|28R,PEGTY-LAVAA,LAVAA7.SUNED,SUNED TRANSITION,PEGTY KELYY ARUPT LAVAA SUNED,KPDX/28L|28R PEGTY KELYY ARUPT LAVAA SUNED
11/27/2025,LAVAA,LAVAA7.LAVAA,ZSE,KPDX/10L|10R,RIVRR-LAVAA,LAVAA7.SUNED,SUNED TRANSITION,RIVRR COSUG OKKOR LAVAA SUNED,KPDX/10L|10R RIVRR COSUG OKKOR LAVAA SUNED
11/27/2025,LAXX,LAXX1.SLI,ZLA,KLAX/06L|06R|07L|07R|24L|24R|25L|25R,SLI,LAXX1.IPL,IMPERIAL TRANSITION,SLI DANAH OCN PILLO IPL,KLAX/06L|06R|07L|07R|24L|24R|25L|25R SLI DANAH OCN PILLO IPL
11/27/2025,LAXX,LAXX1.SLI,ZLA,KLAX/06L|06R|07L|07R|24L|24R|25L|25R,SLI,LAXX1.MZB,MISSION BAY TRANSITION,SLI DANAH OCN CARIF MZB,KLAX/06L|06R|07L|07R|24L|24R|25L|25R SLI DANAH OCN CARIF MZB
11/27/2025,LAXX,LAXX1.SLI,ZLA,KLAX/06L|06R|07L|07R|24L|24R|25L|25R,SLI,LAXX1.OCN,OCEANSIDE TRANSITION,SLI DANAH OCN,KLAX/06L|06R|07L|07R|24L|24R|25L|25R SLI DANAH OCN
11/27/2025,LAXX,LAXX1.SLI,ZLA,KLAX/06L|06R|07L|07R|24L|24R|25L|25R,SLI,LAXX1.ROSIN,ROSIN TRANSITION,SLI SXC GOATZ MALIT ROSIN,KLAX/06L|06R|07L|07R|24L|24R|25L|25R SLI SXC GOATZ MALIT ROSIN
11/27/2025,LAXX,LAXX1.SLI,ZLA,KLAX/06L|06R|07L|07R|24L|24R|25L|25R,SLI,LAXX1.TRM,THERMAL TRANSITION,SLI TUSTI HEMET TRM,KLAX/06L|06R|07L|07R|24L|24R|25L|25R SLI TUSTI HEMET TRM
11/27/2025,LBSTA,LBSTA8.LBSTA,ZBW,KBOS/09,CLAWW-LBSTA,,,CLAWW CLMPP SHAUN LBSTA,KBOS/09 CLAWW CLMPP SHAUN LBSTA
11/27/2025,LBSTA,LBSTA8.LBSTA,ZBW,KBOS/27,KIRAA-LBSTA,,,KIRAA GLOWB HRALD CAMWI LBSTA,KBOS/27 KIRAA GLOWB HRALD CAMWI LBSTA
11/27/2025,LBSTA,LBSTA8.LBSTA,ZBW,KBOS/04R,NHANT-LBSTA,,,NHANT HURBE JENAA SHAUN LBSTA,KBOS/04R NHANT HURBE JENAA SHAUN LBSTA
11/27/2025,LBSTA,LBSTA8.LBSTA,ZBW,KBOS/15R,TASKT-LBSTA,,,TASKT BOATT HEARR SHAUN LBSTA,KBOS/15R TASKT BOATT HEARR SHAUN LBSTA
11/27/2025,LBSTA,LBSTA8.LBSTA,ZBW,KBOS/33L,TEKKK-LBSTA,,,TEKKK MYSTK CAMWI LBSTA,KBOS/33L TEKKK MYSTK CAMWI LBSTA
11/27/2025,LBSTA,LBSTA8.LBSTA,ZBW,KBOS/22L|22R,TJAYY-LBSTA,,,TJAYY BOATT HEARR SHAUN LBSTA,KBOS/22L|22R TJAYY BOATT HEARR SHAUN LBSTA
11/27/2025,EATON,LBY2.LBY,ZHU,KHBG/13|31,LBY,,,LBY,KHBG/13|31 LBY
11/27/2025,LAKE CHARLES,LCH5.LCH,ZHU,KCXO KDWH KIAH,WEDRI-LCH,LCH5.LSU,FIGHTING TIGERS TRANSITION,WEDRI HOURN LCH LSU,KCXO KDWH KIAH WEDRI HOURN LCH LSU
11/27/2025,LEDVE,LEDVE1.CEZ,ZDV,KCEZ/03,CEZ,,,CEZ LEDVE CEZ,KCEZ/03 CEZ LEDVE CEZ
11/27/2025,LEDVE,LEDVE1.CEZ,ZDV,KCEZ/21,ODROE-CEZ,,,ODROE CEZ,KCEZ/21 ODROE CEZ
11/27/2025,LEEAH,LEEAH6.LEEAH,ZDC,KMIV/10|14|28|32,LEEAH,LEEAH6.ATR,WATERLOO TRANSITION,LEEAH ATR,KMIV/10|14|28|32 LEEAH ATR
11/27/2025,LEEAH,LEEAH6.LEEAH,ZDC,KMIV/10|14|28|32,LEEAH,LEEAH6.CYN,COYLE TRANSITION,LEEAH CYN,KMIV/10|14|28|32 LEEAH CYN
11/27/2025,LEEAH,LEEAH6.LEEAH,ZDC,KMIV/10|14|28|32,LEEAH,LEEAH6.ENO,SMYRNA TRANSITION,LEEAH ENO,KMIV/10|14|28|32 LEEAH ENO
11/27/2025,LEINY,LEINY6.LEINY,ZMP,KMSP/04|12L|12R|17|22|30L|30R|35,TONCA-LEINY,,,TONCA BOTNE KUUGL LEINY,KMSP/04|12L|12R|17|22|30L|30R|35 TONCA BOTNE KUUGL LEINY
11/27/2025,LEJON,LEJON5.LEJON,ZHU,KSAT/04|13L|13R|22|31L|31R KSSF/10|14|28|32,SAT-LEJON,,,SAT LEJON,KSAT/04|13L|13R|22|31L|31R KSSF/10|14|28|32 SAT LEJON
11/27/2025,LUFKIN,LFK4.LFK,ZHU,KAXH/09|27 KCXO KDWH KEFD KGLS/14|18|32|36 KHOU/04|13L|13R|22|31L|31R KIAH KIWS KLBX KSGR/17|35 KTME/18|36 T41/05|12|23|30,KYANN-LFK,LFK4.LIT,LITTLE ROCK TRANSITION,KYANN COLET LFK SKKIP CISAR LIT,KAXH/09|27 KCXO KDWH KEFD KGLS/14|18|32|36 KHOU/04|13L|13R|22|31L|31R KIAH KIWS KLBX KSGR/17|35 KTME/18|36 T41/05|12|23|30 KYANN COLET LFK SKKIP CISAR LIT
11/27/2025,LGANN,LGANN1.LGANN,ZLA,KPSP/13L|13R,YUCCA-LGANN,LGANN1.PMD,PALMDALE TRANSITION,YUCCA LGANN SOGGI APLES PMD,KPSP/13L|13R YUCCA LGANN SOGGI APLES PMD
11/27/2025,LA GRANDE,LGD1.LGD,ZSE,KLGD/12|17|30|35,LGD,,,LGD,KLGD/12|17|30|35 LGD
11/27/2025,LGRHD,LGRHD3.LGRHD,ZJX,KCHS/03|33,HALEE-LGRHD,LGRHD3.GIPPL,GIPPL TRANSITION,HALEE LGRHD GIPPL,KCHS/03|33 HALEE LGRHD GIPPL
11/27/2025,LGRHD,LGRHD3.LGRHD,ZJX,KCHS/15|21,LGRHD,LGRHD3.GIPPL,GIPPL TRANSITION,LGRHD GIPPL,KCHS/15|21 LGRHD GIPPL
11/27/2025,LAKE HUGHES,LHS2.LHS,ZLA,KIYK/20,JAGEG-LHS,,,JAGEG MOVIA LHS,KIYK/20 JAGEG MOVIA LHS
11/27/2025,LIBRT,LIBRT3.LIBRT,ZDC,KLYH/04,AGLOW-LIBRT,,,AGLOW BLAMS LIBRT,KLYH/04 AGLOW BLAMS LIBRT
