EFF_DATE,DP_NAME,DP_COMPUTER_CODE,ARTCC,ORIG_GROUP,BODY_NAME,TRANSITION_COMPUTER_CODE,TRANSITION_NAME,ROUTE_POINTS,ROUTE_FROM_ORIG_GROUP
11/27/2025,ESNYE,ESNYE7.ESNYE,ZFW,KDAL/31R,BARYY-ESNYE,ESNYE7.BLECO,BLECO TRANSITION,BARYY WIGIS JYMME BAETZ ESNYE LANEE BLECO,KDAL/31R BARYY WIGIS JYMME BAETZ ESNYE LANEE BLECO
11/27/2025,ESNYE,ESNYE7.ESNYE,ZFW,KDAL/31L,FLOWT-ESNYE,ESNYE7.BLECO,BLECO TRANSITION,FLOWT WIGIS JYMME BAETZ ESNYE LANEE BLECO,KDAL/31L FLOWT WIGIS JYMME BAETZ ESNYE LANEE BLECO
11/27/2025,ESNYE,ESNYE7.ESNYE,ZFW,KDAL/13L|13R,WIGIS-ESNYE,ESNYE7.BLECO,BLECO TRANSITION,WIGIS JYMME BAETZ ESNYE LANEE BLECO,KDAL/13L|13R WIGIS JYMME BAETZ ESNYE LANEE BLECO
11/27/2025,ESNYE,ESNYE7.ESNYE,ZFW,KDAL/31R,BARYY-ESNYE,ESNYE7.EAKER,EAKER TRANSITION,BARYY WIGIS JYMME BAETZ ESNYE GRABE EAKER,KDAL/31R BARYY WIGIS JYMME BAETZ ESNYE GRABE EAKER
11/27/2025,ESNYE,ESNYE7.ESNYE,ZFW,KDAL/31L,FLOWT-ESNYE,ESNYE7.EAKER,EAKER TRANSITION,FLOWT WIGIS JYMME BAETZ ESNYE GRABE EAKER,KDAL/31L FLOWT WIGIS JYMME BAETZ ESNYE GRABE EAKER
11/27/2025,ESNYE,ESNYE7.ESNYE,ZFW,KDAL/13L|13R,WIGIS-ESNYE,ESNYE7.EAKER,EAKER TRANSITION,WIGIS JYMME BAETZ ESNYE GRABE EAKER,KDAL/13L|13R WIGIS JYMME BAETZ ESNYE GRABE EAKER
11/27/2025,ESNYE,ESNYE7.ESNYE,ZFW,KDAL/31R,BARYY-ESNYE,ESNYE7.GRABE,GRABE TRANSITION,BARYY WIGIS JYMME BAETZ ESNYE GRABE,KDAL/31R BARYY WIGIS JYMME BAETZ ESNYE GRABE
11/27/2025,ESNYE,ESNYE7.ESNYE,ZFW,KDAL/31L,FLOWT-ESNYE,ESNYE7.GRABE,GRABE TRANSITION,FLOWT WIGIS JYMME BAETZ ESNYE GRABE,KDAL/31L FLOWT WIGIS JYMME BAETZ ESNYE GRABE
11/27/2025,ESNYE,ESNYE7.ESNYE,ZFW,KDAL/13L|13R,WIGIS-ESNYE,ESNYE7.GRABE,GRABE TRANSITION,WIGIS JYMME BAETZ ESNYE GRABE,KDAL/13L|13R WIGIS JYMME BAETZ ESNYE GRABE
11/27/2025,ESNYE,ESNYE7.ESNYE,ZFW,KDAL/31R,BARYY-ESNYE,ESNYE7.IRW,WILL ROGERS TRANSITION,BARYY WIGIS JYMME BAETZ ESNYE LANEE BLECO ZEMMA IRW,KDAL/31R BARYY WIGIS JYMME BAETZ ESNYE LANEE BLECO ZEMMA IRW
11/27/2025,ESNYE,ESNYE7.ESNYE,ZFW,KDAL/31L,FLOWT-ESNYE,ESNYE7.IRW,WILL ROGERS TRANSITION,FLOWT WIGIS JYMME BAETZ ESNYE LANEE BLECO ZEMMA IRW,KDAL/31L FLOWT WIGIS JYMME BAETZ ESNYE LANEE BLECO ZEMMA IRW
11/27/2025,ESNYE,ESNYE7.ESNYE,ZFW,KDAL/13L|13R,WIGIS-ESNYE,ESNYE7.IRW,WILL ROGERS TRANSITION,WIGIS JYMME BAETZ ESNYE LANEE BLECO ZEMMA IRW,KDAL/13L|13R WIGIS JYMME BAETZ ESNYE LANEE BLECO ZEMMA IRW
11/27/2025,ESNYE,ESNYE7.ESNYE,ZFW,KDAL/31R,BARYY-ESNYE,ESNYE7.MLC,MC ALESTER TRANSITION,BARYY WIGIS JYMME BAETZ ESNYE AKUNA TIKYS MLC,KDAL/31R BARYY WIGIS JYMME BAETZ ESNYE AKUNA TIKYS MLC
11/27/2025,ESNYE,ESNYE7.ESNYE,ZFW,KDAL/31L,FLOWT-ESNYE,ESNYE7.MLC,MC ALESTER TRANSITION,FLOWT WIGIS JYMME BAETZ ESNYE AKUNA TIKYS MLC,KDAL/31L FLOWT WIGIS JYMME BAETZ ESNYE AKUNA TIKYS MLC
11/27/2025,ESNYE,ESNYE7.ESNYE,ZFW,KDAL/13L|13R,WIGIS-ESNYE,ESNYE7.MLC,MC ALESTER TRANSITION,WIGIS JYMME BAETZ ESNYE AKUNA TIKYS MLC,KDAL/13L|13R WIGIS JYMME BAETZ ESNYE AKUNA TIKYS MLC
11/27/2025,ESNYE,ESNYE7.ESNYE,ZFW,KDAL/31R,BARYY-ESNYE,ESNYE7.OKM,OKMULGEE TRANSITION,BARYY WIGIS JYMME BAETZ ESNYE GRABE EAKER OKM,KDAL/31R BARYY WIGIS JYMME BAETZ ESNYE GRABE EAKER OKM
11/27/2025,ESNYE,ESNYE7.ESNYE,ZFW,KDAL/31L,FLOWT-ESNYE,ESNYE7.OKM,OKMULGEE TRANSITION,FLOWT WIGIS JYMME BAETZ ESNYE GRABE EAKER OKM,KDAL/31L FLOWT WIGIS JYMME BAETZ ESNYE GRABE EAKER OKM
11/27/2025,ESNYE,ESNYE7.ESNYE,ZFW,KDAL/13L|13R,WIGIS-ESNYE,ESNYE7.OKM,OKMULGEE TRANSITION,WIGIS JYMME BAETZ ESNYE GRABE EAKER OKM,KDAL/13L|13R WIGIS JYMME BAETZ ESNYE GRABE EAKER OKM
11/27/2025,ESNYE,ESNYE7.ESNYE,ZFW,KDAL/31R,BARYY-ESNYE,ESNYE7.ROLLS,ROLLS TRANSITION,BARYY WIGIS JYMME BAETZ ESNYE LANEE LOWGN ADM MRMAC ROLLS,KDAL/31R BARYY WIGIS JYMME BAETZ ESNYE LANEE LOWGN ADM MRMAC ROLLS
11/27/2025,ESNYE,ESNYE7.ESNYE,ZFW,KDAL/31L,FLOWT-ESNYE,ESNYE7.ROLLS,ROLLS TRANSITION,FLOWT WIGIS JYMME BAETZ ESNYE LANEE LOWGN ADM MRMAC ROLLS,KDAL/31L FLOWT WIGIS JYMME BAETZ ESNYE LANEE LOWGN ADM MRMAC ROLLS
11/27/2025,ESNYE,ESNYE7.ESNYE,ZFW,KDAL/13L|13R,WIGIS-ESNYE,ESNYE7.ROLLS,ROLLS TRANSITION,WIGIS JYMME BAETZ ESNYE LANEE LOWGN ADM MRMAC ROLLS,KDAL/13L|13R WIGIS JYMME BAETZ ESNYE LANEE LOWGN ADM MRMAC ROLLS
11/27/2025,ESNYE,ESNYE7.ESNYE,ZFW,KDAL/31R,BARYY-ESNYE,ESNYE7.TIKYS,TIKYS TRANSITION,BARYY WIGIS JYMME BAETZ ESNYE AKUNA TIKYS,KDAL/31R BARYY WIGIS JYMME BAETZ ESNYE AKUNA TIKYS
11/27/2025,ESNYE,ESNYE7.ESNYE,ZFW,KDAL/31L,FLOWT-ESNYE,ESNYE7.TIKYS,TIKYS TRANSITION,FLOWT WIGIS JYMME BAETZ ESNYE AKUNA TIKYS,KDAL/31L FLOWT WIGIS JYMME BAETZ ESNYE AKUNA TIKYS
11/27/2025,ESNYE,ESNYE7.ESNYE,ZFW,KDAL/13L|13R,WIGIS-ESNYE,ESNYE7.TIKYS,TIKYS TRANSITION,WIGIS JYMME BAETZ ESNYE AKUNA TIKYS,KDAL/13L|13R WIGIS JYMME BAETZ ESNYE AKUNA TIKYS
11/27/2025,ESNYE,ESNYE7.ESNYE,ZFW,KDAL/31R,BARYY-ESNYE,ESNYE7.TUL,TULSA TRANSITION,BARYY WIGIS JYMME BAETZ ESNYE LANEE BLECO ZEMMA TUL,KDAL/31R BARYY WIGIS JYMME BAETZ ESNYE LANEE BLECO ZEMMA TUL
11/27/2025,ESNYE,ESNYE7.ESNYE,ZFW,KDAL/31L,FLOWT-ESNYE,ESNYE7.TUL,TULSA TRANSITION,FLOWT WIGIS JYMME BAETZ ESNYE LANEE BLECO ZEMMA TUL,KDAL/31L FLOWT WIGIS JYMME BAETZ ESNYE LANEE BLECO ZEMMA TUL
11/27/2025,ESNYE,ESNYE7.ESNYE,ZFW,KDAL/13L|13R,WIGIS-ESNYE,ESNYE7.TUL,TULSA TRANSITION,WIGIS JYMME BAETZ ESNYE LANEE BLECO ZEMMA TUL,KDAL/13L|13R WIGIS JYMME BAETZ ESNYE LANEE BLECO ZEMMA TUL
11/27/2025,ESNYE,ESNYE7.ESNYE,ZFW,KDAL/31R,BARYY-ESNYE,ESNYE7.ZEMMA,ZEMMA TRANSITION,BARYY WIGIS JYMME BAETZ ESNYE BLECO ZEMMA,KDAL/31R BARYY WIGIS JYMME BAETZ ESNYE BLECO ZEMMA
11/27/2025,ESNYE,ESNYE7.ESNYE,ZFW,KDAL/31L,FLOWT-ESNYE,ESNYE7.ZEMMA,ZEMMA TRANSITION,FLOWT WIGIS JYMME BAETZ ESNYE BLECO ZEMMA,KDAL/31L FLOWT WIGIS JYMME BAETZ ESNYE BLECO ZEMMA
11/27/2025,ESNYE,ESNYE7.ESNYE,ZFW,KDAL/13L|13R,WIGIS-ESNYE,ESNYE7.ZEMMA,ZEMMA TRANSITION,WIGIS JYMME BAETZ ESNYE BLECO ZEMMA,KDAL/13L|13R WIGIS JYMME BAETZ ESNYE BLECO ZEMMA
11/27/2025,ESTRR,ESTRR5.ESTRR,ZTL,KAKH/03|21 KCLT/18C|18L|18R|36C|36L|36R KEQY KIPJ/05|23 KJQF/02|20 KLKR KRUQ/02|20 KUZA KVUJ,GINNN-ESTRR,ESTRR5.IPTAY,IPTAY TRANSITION,GINNN ESTRR DEBIE IPTAY,KAKH/03|21 KCLT/18C|18L|18R|36C|36L|36R KEQY KIPJ/05|23 KJQF/02|20 KLKR KRUQ/02|20 KUZA KVUJ GINNN ESTRR DEBIE IPTAY
11/27/2025,EXBOX,EXBOX2.EXBOX,ZJX,KJAX/08|14|26|32,SAWGY-EXBOX,EXBOX2.OMN,ORMOND BEACH TRANSITION,SAWGY EXBOX OMN,KJAX/08|14|26|32 SAWGY EXBOX OMN
11/27/2025,EXCON,EXCON1.EXCON,ZLA,KAPV/36,HUNEY-EXCON,,,HUNEY EXCON,KAPV/36 HUNEY EXCON
11/27/2025,EXTAN,EXTAN7.SHAYK,ZDV,KDEN/25,EXTAN-SHAYK,,,EXTAN CABET SHAYK,KDEN/25 EXTAN CABET SHAYK
11/27/2025,EXTAN,EXTAN7.SHAYK,ZDV,KDEN/16L|16R|17L|17R,GISTT-SHAYK,,,GISTT BGONE OLDDD MMESA FALUJ EXTAN CABET SHAYK,KDEN/16L|16R|17L|17R GISTT BGONE OLDDD MMESA FALUJ EXTAN CABET SHAYK
11/27/2025,EXTAN,EXTAN7.SHAYK,ZDV,KDEN/08|34L|34R|35L|35R,KIDNG-SHAYK,,,KIDNG KMBEL BHIGH MMESA FALUJ EXTAN CABET SHAYK,KDEN/08|34L|34R|35L|35R KIDNG KMBEL BHIGH MMESA FALUJ EXTAN CABET SHAYK
11/27/2025,EXECUTIVE,EXTVE1.PLFMD,ZJX,KJZI/04|09|22|27,RNDAH-PLFMD,EXTVE1.ALD,ALLENDALE TRANSITION,RNDAH GECHE GULLA PLFMD ALD,KJZI/04|09|22|27 RNDAH GECHE GULLA PLFMD ALD
11/27/2025,EXECUTIVE,EXTVE1.PLFMD,ZJX,KJZI/04|09|22|27,RNDAH-PLFMD,EXTVE1.DBN,DUBLIN TRANSITION,RNDAH GECHE GULLA PLFMD DBN,KJZI/04|09|22|27 RNDAH GECHE GULLA PLFMD DBN
11/27/2025,EXECUTIVE,EXTVE1.PLFMD,ZJX,KJZI/04|09|22|27,RNDAH-PLFMD,EXTVE1.IRQ,COLLIERS TRANSITION,RNDAH GECHE GULLA PLFMD FIBRO IRQ,KJZI/04|09|22|27 RNDAH GECHE GULLA PLFMD FIBRO IRQ
11/27/2025,EYAKS,EYAKS6.EYAKS,ZAN,PACV/09|27,EYAKS,,,EYAKS,PACV/09|27 EYAKS
11/27/2025,EYESE,EYESE2.EYESE,ZSE,S59/15,EYESE,,,EYESE,S59/15 EYESE
11/27/2025,EZEPU,EZEPU1.EZEPU,ZAN,POKA/16,APPAG-EZEPU,,,APPAG OZPEB EZEPU,POKA/16 APPAG OZPEB EZEPU
11/27/2025,EZEPU,EZEPU1.EZEPU,ZAN,POKA/34,PYCHE-EZEPU,,,PYCHE UCIXO EZEPU,POKA/34 PYCHE UCIXO EZEPU
11/27/2025,FAHLZ,FAHLZ1.FAHLZ,ZLC,KIDA/03,FAHLZ,FAHLZ1.KAYTT,KAYTT TRANSITION,FAHLZ FRGNA KAYTT,KIDA/03 FAHLZ FRGNA KAYTT
11/27/2025,FAHLZ,FAHLZ1.FAHLZ,ZLC,KIDA/03,FAHLZ,FAHLZ1.SABAT,SABAT TRANSITION,FAHLZ SABAT,KIDA/03 FAHLZ SABAT
11/27/2025,FAHLZ,FAHLZ1.FAHLZ,ZLC,KIDA/03,FAHLZ,FAHLZ1.SHAEL,SHAEL TRANSITION,FAHLZ SHAEL,KIDA/03 FAHLZ SHAEL
11/27/2025,FAKES,FAKES4.FAKES,ZAN,PAYA/02|11|20|29,FAKES,,,FAKES,PAYA/02|11|20|29 FAKES
11/27/2025,FALCC,FALCC1.FALCC,ZLA,KSAN/27,CLSTR-FALCC,FALCC1.SLI,SEAL BEACH TRANSITION,CLSTR MAFAN FALCC SLI,KSAN/27 CLSTR MAFAN FALCC SLI
11/27/2025,FALCC,FALCC1.FALCC,ZLA,KSAN/09,MAFAN-FALCC,FALCC1.SLI,SEAL BEACH TRANSITION,MAFAN FALCC SLI,KSAN/09 MAFAN FALCC SLI
11/27/2025,FALCC,FALCC1.FALCC,ZLA,KSAN/27,CLSTR-FALCC,FALCC1.SXC,SANTA CATALINA TRANSITION,CLSTR MAFAN FALCC SXC,KSAN/27 CLSTR MAFAN FALCC SXC
11/27/2025,FALCC,FALCC1.FALCC,ZLA,KSAN/09,MAFAN-FALCC,FALCC1.SXC,SANTA CATALINA TRANSITION,MAFAN FALCC SXC,KSAN/09 MAFAN FALCC SXC
11/27/2025,FARMINGTON,FARM7.UBG,ZSE,KHIO/02|13L|13R|20|31L|31R,UBG,,,UBG,KHIO/02|13L|13R|20|31L|31R UBG
11/27/2025,FATHE,FATHE4.FATHE,ZJX,KMCO/36R,FACTS-FATHE,FATHE4.VIYAP,VIYAP TRANSITION,FACTS HANDD TRYNA BUFFI FATHE MDBOG BKENI FEMON VIYAP,KMCO/36R FACTS HANDD TRYNA BUFFI FATHE MDBOG BKENI FEMON VIYAP
11/27/2025,FATHE,FATHE4.FATHE,ZJX,KMCO/35L|35R,JWOLF-FATHE,FATHE4.VIYAP,VIYAP TRANSITION,JWOLF JIRAN BIGSE GOTHA BUFFI FATHE MDBOG BKENI FEMON VIYAP,KMCO/35L|35R JWOLF JIRAN BIGSE GOTHA BUFFI FATHE MDBOG BKENI FEMON VIYAP
11/27/2025,FATHE,FATHE4.FATHE,ZJX,KMCO/17L|17R,KAAPE-FATHE,FATHE4.VIYAP,VIYAP TRANSITION,KAAPE BUFFI FATHE MDBOG BKENI FEMON VIYAP,KMCO/17L|17R KAAPE BUFFI FATHE MDBOG BKENI FEMON VIYAP
11/27/2025,FATHE,FATHE4.FATHE,ZJX,KMCO/36L,KYOTE-FATHE,FATHE4.VIYAP,VIYAP TRANSITION,KYOTE EARRS TRYNA BUFFI FATHE MDBOG BKENI FEMON VIYAP,KMCO/36L KYOTE EARRS TRYNA BUFFI FATHE MDBOG BKENI FEMON VIYAP
11/27/2025,FATHE,FATHE4.FATHE,ZJX,KMCO/18L|18R,VILNS-FATHE,FATHE4.VIYAP,VIYAP TRANSITION,VILNS BUFFI FATHE MDBOG BKENI FEMON VIYAP,KMCO/18L|18R VILNS BUFFI FATHE MDBOG BKENI FEMON VIYAP
11/27/2025,FORT BRIDGER,FBR1.FBR,ZLC,KEVW/05|23,FBR,,,FBR,KEVW/05|23 FBR
11/27/2025,FEALX,FEALX2.FEALX,ZMA,KFLL/10R,CLPSO-FEALX,FEALX2.ETECK,ETECK TRANSITION,CLPSO MIMSE FEALX BKING WOLFO ETECK,KFLL/10R CLPSO MIMSE FEALX BKING WOLFO ETECK
11/27/2025,FEALX,FEALX2.FEALX,ZMA,KFLL/28L|28R,DREDS-FEALX,FEALX2.ETECK,ETECK TRANSITION,DREDS SHELZ JMACA BEEDZ LNKIN FEALX BKING WOLFO ETECK,KFLL/28L|28R DREDS SHELZ JMACA BEEDZ LNKIN FEALX BKING WOLFO ETECK
11/27/2025,FEALX,FEALX2.FEALX,ZMA,KFXE/09|13|27|31 KPMP/06|10|15|24|28|33,FEALX,FEALX2.ETECK,ETECK TRANSITION,FEALX BKING WOLFO ETECK,KFXE/09|13|27|31 KPMP/06|10|15|24|28|33 FEALX BKING WOLFO ETECK
11/27/2025,FEALX,FEALX2.FEALX,ZMA,KFLL/10L,MRLEE-FEALX,FEALX2.ETECK,ETECK TRANSITION,MRLEE MIMSE FEALX BKING WOLFO ETECK,KFLL/10L MRLEE MIMSE FEALX BKING WOLFO ETECK
11/27/2025,FEALX,FEALX2.FEALX,ZMA,KFLL/10R,CLPSO-FEALX,FEALX2.PADUS,PADUS TRANSITION,CLPSO MIMSE FEALX PADUS,KFLL/10R CLPSO MIMSE FEALX PADUS
11/27/2025,FEALX,FEALX2.FEALX,ZMA,KFLL/28L|28R,DREDS-FEALX,FEALX2.PADUS,PADUS TRANSITION,DREDS SHELZ JMACA BEEDZ LNKIN FEALX PADUS,KFLL/28L|28R DREDS SHELZ JMACA BEEDZ LNKIN FEALX PADUS
11/27/2025,FEALX,FEALX2.FEALX,ZMA,KFXE/09|13|27|31 KPMP/06|10|15|24|28|33,FEALX,FEALX2.PADUS,PADUS TRANSITION,FEALX PADUS,KFXE/09|13|27|31 KPMP/06|10|15|24|28|33 FEALX PADUS
11/27/2025,FEALX,FEALX2.FEALX,ZMA,KFLL/10L,MRLEE-FEALX,FEALX2.PADUS,PADUS TRANSITION,MRLEE MIMSE FEALX PADUS,KFLL/10L MRLEE MIMSE FEALX PADUS
11/27/2025,FEALX,FEALX2.FEALX,ZMA,KFLL/10R,CLPSO-FEALX,FEALX2.SNAGY,SNAGY TRANSITION,CLPSO MIMSE FEALX BKING WOLFO SNAGY,KFLL/10R CLPSO MIMSE FEALX BKING WOLFO SNAGY
11/27/2025,FEALX,FEALX2.FEALX,ZMA,KFLL/28L|28R,DREDS-FEALX,FEALX2.SNAGY,SNAGY TRANSITION,DREDS SHELZ JMACA BEEDZ LNKIN FEALX BKING WOLFO SNAGY,KFLL/28L|28R DREDS SHELZ JMACA BEEDZ LNKIN FEALX BKING WOLFO SNAGY
11/27/2025,FEALX,FEALX2.FEALX,ZMA,KFXE/09|13|27|31 KPMP/06|10|15|24|28|33,FEALX,FEALX2.SNAGY,SNAGY TRANSITION,FEALX BKING WOLFO SNAGY,KFXE/09|13|27|31 KPMP/06|10|15|24|28|33 FEALX BKING WOLFO SNAGY
11/27/2025,FEALX,FEALX2.FEALX,ZMA,KFLL/10L,MRLEE-FEALX,FEALX2.SNAGY,SNAGY TRANSITION,MRLEE MIMSE FEALX BKING WOLFO SNAGY,KFLL/10L MRLEE MIMSE FEALX BKING WOLFO SNAGY
11/27/2025,FEALX,FEALX2.FEALX,ZMA,KFLL/10R,CLPSO-FEALX,FEALX2.SUMRS,SUMRS TRANSITION,CLPSO MIMSE FEALX BKING WOLFO SUMRS,KFLL/10R CLPSO MIMSE FEALX BKING WOLFO SUMRS
11/27/2025,FEALX,FEALX2.FEALX,ZMA,KFLL/28L|28R,DREDS-FEALX,FEALX2.SUMRS,SUMRS TRANSITION,DREDS SHELZ JMACA BEEDZ LNKIN FEALX BKING WOLFO SUMRS,KFLL/28L|28R DREDS SHELZ JMACA BEEDZ LNKIN FEALX BKING WOLFO SUMRS
11/27/2025,FEALX,FEALX2.FEALX,ZMA,KFXE/09|13|27|31 KPMP/06|10|15|24|28|33,FEALX,FEALX2.SUMRS,SUMRS TRANSITION,FEALX BKING WOLFO SUMRS,KFXE/09|13|27|31 KPMP/06|10|15|24|28|33 FEALX BKING WOLFO SUMRS
11/27/2025,FEALX,FEALX2.FEALX,ZMA,KFLL/10L,MRLEE-FEALX,FEALX2.SUMRS,SUMRS TRANSITION,MRLEE MIMSE FEALX BKING WOLFO SUMRS,KFLL/10L MRLEE MIMSE FEALX BKING WOLFO SUMRS
11/27/2025,FEALX,FEALX2.FEALX,ZMA,KFLL/10R,CLPSO-FEALX,FEALX2.WOLFO,WOLFO TRANSITION,CLPSO MIMSE FEALX BKING WOLFO,KFLL/10R CLPSO MIMSE FEALX BKING WOLFO
11/27/2025,FEALX,FEALX2.FEALX,ZMA,KFLL/28L|28R,DREDS-FEALX,FEALX2.WOLFO,WOLFO TRANSITION,DREDS SHELZ JMACA BEEDZ LNKIN FEALX BKING WOLFO,KFLL/28L|28R DREDS SHELZ JMACA BEEDZ LNKIN FEALX BKING WOLFO
11/27/2025,FEALX,FEALX2.FEALX,ZMA,KFXE/09|13|27|31 KPMP/06|10|15|24|28|33,FEALX,FEALX2.WOLFO,WOLFO TRANSITION,FEALX BKING WOLFO,KFXE/09|13|27|31 KPMP/06|10|15|24|28|33 FEALX BKING WOLFO
11/27/2025,FEALX,FEALX2.FEALX,ZMA,KFLL/10L,MRLEE-FEALX,FEALX2.WOLFO,WOLFO TRANSITION,MRLEE MIMSE FEALX BKING WOLFO,KFLL/10L MRLEE MIMSE FEALX BKING WOLFO
11/27/2025,FEALX,FEALX2.FEALX,ZMA,KFLL/10R,CLPSO-FEALX,FEALX2.ZFP,FREEPORT TRANSITION,CLPSO MIMSE FEALX PREDA ZFP,KFLL/10R CLPSO MIMSE FEALX PREDA ZFP
11/27/2025,FEALX,FEALX2.FEALX,ZMA,KFLL/28L|28R,DREDS-FEALX,FEALX2.ZFP,FREEPORT TRANSITION,DREDS SHELZ JMACA BEEDZ LNKIN FEALX PREDA ZFP,KFLL/28L|28R DREDS SHELZ JMACA BEEDZ LNKIN FEALX PREDA ZFP
11/27/2025,FEALX,FEALX2.FEALX,ZMA,KFXE/09|13|27|31 KPMP/06|10|15|24|28|33,FEALX,FEALX2.ZFP,FREEPORT TRANSITION,FEALX PREDA ZFP,KFXE/09|13|27|31 KPMP/06|10|15|24|28|33 FEALX PREDA ZFP
11/27/2025,FEALX,FEALX2.FEALX,ZMA,KFLL/10L,MRLEE-FEALX,FEALX2.ZFP,FREEPORT TRANSITION,MRLEE MIMSE FEALX PREDA ZFP,KFLL/10L MRLEE MIMSE FEALX PREDA ZFP
11/27/2025,FEGBA,FEGBA3.FEGBA,ZVR,KORS/16,FEGBA,,,FEGBA,KORS/16 FEGBA
11/27/2025,FESKO,FESKO1.FESKO,ZLC,KWMC/02|14|20|32,FESKO,,,FESKO,KWMC/02|14|20|32 FESKO
11/27/2025,FETUJ,FETUJ3.FETUJ,ZSE,KTMK/31,FETUJ,,,FETUJ,KTMK/31 FETUJ
11/27/2025,FFITZ,FFITZ4.FFITZ,ZAN,PANC/33,ISACC-FFITZ,,,ISACC RRROB EVRTS DCSIX FRIDA FFITZ,PANC/33 ISACC RRROB EVRTS DCSIX FRIDA FFITZ
11/27/2025,FFITZ,FFITZ4.FFITZ,ZAN,PANC/25L|25R,VUYWO-FFITZ,,,VUYWO OGOLY EVRTS DCSIX FRIDA FFITZ,PANC/25L|25R VUYWO OGOLY EVRTS DCSIX FRIDA FFITZ
11/27/2025,FAIRFIELD,FFU9.FFU,ZLC,KSLC/16L|16R|17,FFU,FFU9.BCE,BRYCE CANYON TRANSITION,FFU LODUY URNUW BCE,KSLC/16L|16R|17 FFU LODUY URNUW BCE
11/27/2025,FAIRFIELD,FFU9.FFU,ZLC,KSLC/16L|16R|17,FFU,FFU9.HVE,HANKSVILLE TRANSITION,FFU OHQES HVE,KSLC/16L|16R|17 FFU OHQES HVE
11/27/2025,FAIRFIELD,FFU9.FFU,ZLC,KSLC/16L|16R|17,FFU,FFU9.MLF,MILFORD TRANSITION,FFU LODUY URNUW MLF,KSLC/16L|16R|17 FFU LODUY URNUW MLF
11/27/2025,FAIRFIELD,FFU9.FFU,ZLC,KSLC/16L|16R|17,FFU,FFU9.OAL,COALDALE TRANSITION,FFU LODUY URNUW MLF ILC TPH OAL,KSLC/16L|16R|17 FFU LODUY URNUW MLF ILC TPH OAL
11/27/2025,FICHU,FICHU4.HABXU,ZOA,O22/17,FICHU-HABXU,,,FICHU GONAQ HABXU,O22/17 FICHU GONAQ HABXU
11/27/2025,FINZZ,FINZZ3.FINZZ,ZLA,KSNA/20R,STREL-FINZZ,FINZZ3.BEALE,BEALE TRANSITION,STREL DOLLF FINZZ CAHIL ZOOMM SEBBY PLAYY ARCUS YELAH WYZEE BEALE,KSNA/20R STREL DOLLF FINZZ CAHIL ZOOMM SEBBY PLAYY ARCUS YELAH WYZEE BEALE
11/27/2025,FINZZ,FINZZ3.FINZZ,ZLA,KSNA/20R,STREL-FINZZ,FINZZ3.HAILO,HAILO TRANSITION,STREL DOLLF FINZZ CAHIL ZOOMM SEBBY PLAYY GUNNR ARRMY HAILO,KSNA/20R STREL DOLLF FINZZ CAHIL ZOOMM SEBBY PLAYY GUNNR ARRMY HAILO
11/27/2025,FINZZ,FINZZ3.FINZZ,ZLA,KSNA/20R,STREL-FINZZ,FINZZ3.LAS,LAS VEGAS TRANSITION,STREL DOLLF FINZZ CAHIL ZOOMM SEBBY PLAYY NNAVY BLAZN LAS,KSNA/20R STREL DOLLF FINZZ CAHIL ZOOMM SEBBY PLAYY NNAVY BLAZN LAS
11/27/2025,FINZZ,FINZZ3.FINZZ,ZLA,KSNA/20R,STREL-FINZZ,FINZZ3.MISEN,MISEN TRANSITION,STREL DOLLF FINZZ CAHIL ZOOMM SEBBY PLAYY ARCUS YELAH MISEN,KSNA/20R STREL DOLLF FINZZ CAHIL ZOOMM SEBBY PLAYY ARCUS YELAH MISEN
11/27/2025,FINZZ,FINZZ3.FINZZ,ZLA,KSNA/20R,STREL-FINZZ,FINZZ3.NNAVY,NNAVY TRANSITION,STREL DOLLF FINZZ CAHIL ZOOMM SEBBY PLAYY NNAVY,KSNA/20R STREL DOLLF FINZZ CAHIL ZOOMM SEBBY PLAYY NNAVY
11/27/2025,FIROS,FIROS1.FIROS,ZLC,1U7/10|16,FIROS,,,FIROS,1U7/10|16 FIROS
11/27/2025,FIXET,FIXET5.FIXET,ZDC,KBWI/28,BOSLY-FIXET,FIXET5.FLASK,FLASK TRANSITION,BOSLY SUGGS STABL OHSSS CONLE FIXET CLTCH KERRK TEEMS FLASK,KBWI/28 BOSLY SUGGS STABL OHSSS CONLE FIXET CLTCH KERRK TEEMS FLASK
11/27/2025,FIXET,FIXET5.FIXET,ZDC,KBWI/15L,GAGLR-FIXET,FIXET5.FLASK,FLASK TRANSITION,GAGLR BEWEE OHSSS CONLE FIXET CLTCH KERRK TEEMS FLASK,KBWI/15L GAGLR BEWEE OHSSS CONLE FIXET CLTCH KERRK TEEMS FLASK
11/27/2025,FIXET,FIXET5.FIXET,ZDC,KBWI/10,JWALL-FIXET,FIXET5.FLASK,FLASK TRANSITION,JWALL BEWEE OHSSS CONLE FIXET CLTCH KERRK TEEMS FLASK,KBWI/10 JWALL BEWEE OHSSS CONLE FIXET CLTCH KERRK TEEMS FLASK
11/27/2025,FIXET,FIXET5.FIXET,ZDC,KBWI/15R,KEMMP-FIXET,FIXET5.FLASK,FLASK TRANSITION,KEMMP BEWEE OHSSS CONLE FIXET CLTCH KERRK TEEMS FLASK,KBWI/15R KEMMP BEWEE OHSSS CONLE FIXET CLTCH KERRK TEEMS FLASK
11/27/2025,FIXET,FIXET5.FIXET,ZDC,KBWI/33L|33R,SUGGS-FIXET,FIXET5.FLASK,FLASK TRANSITION,SUGGS STABL OHSSS CONLE FIXET CLTCH KERRK TEEMS FLASK,KBWI/33L|33R SUGGS STABL OHSSS CONLE FIXET CLTCH KERRK TEEMS FLASK
11/27/2025,FIXET,FIXET5.FIXET,ZDC,KBWI/28,BOSLY-FIXET,FIXET5.GLANC,GLANC TRANSITION,BOSLY SUGGS STABL OHSSS CONLE FIXET SCRAM DANOO WALCE GLANC,KBWI/28 BOSLY SUGGS STABL OHSSS CONLE FIXET SCRAM DANOO WALCE GLANC
11/27/2025,FIXET,FIXET5.FIXET,ZDC,KBWI/15L,GAGLR-FIXET,FIXET5.GLANC,GLANC TRANSITION,GAGLR BEWEE OHSSS CONLE FIXET SCRAM DANOO WALCE GLANC,KBWI/15L GAGLR BEWEE OHSSS CONLE FIXET SCRAM DANOO WALCE GLANC
11/27/2025,FIXET,FIXET5.FIXET,ZDC,KBWI/10,JWALL-FIXET,FIXET5.GLANC,GLANC TRANSITION,JWALL BEWEE OHSSS CONLE FIXET SCRAM DANOO WALCE GLANC,KBWI/10 JWALL BEWEE OHSSS CONLE FIXET SCRAM DANOO WALCE GLANC
11/27/2025,FIXET,FIXET5.FIXET,ZDC,KBWI/15R,KEMMP-FIXET,FIXET5.GLANC,GLANC TRANSITION,KEMMP BEWEE OHSSS CONLE FIXET SCRAM DANOO WALCE GLANC,KBWI/15R KEMMP BEWEE OHSSS CONLE FIXET SCRAM DANOO WALCE GLANC
11/27/2025,FIXET,FIXET5.FIXET,ZDC,KBWI/33L|33R,SUGGS-FIXET,FIXET5.GLANC,GLANC TRANSITION,SUGGS STABL OHSSS CONLE FIXET SCRAM DANOO WALCE GLANC,KBWI/33L|33R SUGGS STABL OHSSS CONLE FIXET SCRAM DANOO WALCE GLANC
11/27/2025,FIXET,FIXET5.FIXET,ZDC,KBWI/28,BOSLY-FIXET,FIXET5.MAULS,MAULS TRANSITION,BOSLY SUGGS STABL OHSSS CONLE FIXET CLTCH KERRK MAULS,KBWI/28 BOSLY SUGGS STABL OHSSS CONLE FIXET CLTCH KERRK MAULS
11/27/2025,FIXET,FIXET5.FIXET,ZDC,KBWI/15L,GAGLR-FIXET,FIXET5.MAULS,MAULS TRANSITION,GAGLR BEWEE OHSSS CONLE FIXET CLTCH KERRK MAULS,KBWI/15L GAGLR BEWEE OHSSS CONLE FIXET CLTCH KERRK MAULS
11/27/2025,FIXET,FIXET5.FIXET,ZDC,KBWI/10,JWALL-FIXET,FIXET5.MAULS,MAULS TRANSITION,JWALL BEWEE OHSSS CONLE FIXET CLTCH KERRK MAULS,KBWI/10 JWALL BEWEE OHSSS CONLE FIXET CLTCH KERRK MAULS
11/27/2025,FIXET,FIXET5.FIXET,ZDC,KBWI/15R,KEMMP-FIXET,FIXET5.MAULS,MAULS TRANSITION,KEMMP BEWEE OHSSS CONLE FIXET CLTCH KERRK MAULS,KBWI/15R KEMMP BEWEE OHSSS CONLE FIXET CLTCH KERRK MAULS
11/27/2025,FIXET,FIXET5.FIXET,ZDC,KBWI/33L|33R,SUGGS-FIXET,FIXET5.MAULS,MAULS TRANSITION,SUGGS STABL OHSSS CONLE FIXET CLTCH KERRK MAULS,KBWI/33L|33R SUGGS STABL OHSSS CONLE FIXET CLTCH KERRK MAULS
11/27/2025,FIXET,FIXET5.FIXET,ZDC,KBWI/28,BOSLY-FIXET,FIXET5.MELTN,MELTN TRANSITION,BOSLY SUGGS STABL OHSSS CONLE FIXET JDUBB CASLY MELTN,KBWI/28 BOSLY SUGGS STABL OHSSS CONLE FIXET JDUBB CASLY MELTN
11/27/2025,FIXET,FIXET5.FIXET,ZDC,KBWI/15L,GAGLR-FIXET,FIXET5.MELTN,MELTN TRANSITION,GAGLR BEWEE OHSSS CONLE FIXET JDUBB CASLY MELTN,KBWI/15L GAGLR BEWEE OHSSS CONLE FIXET JDUBB CASLY MELTN
11/27/2025,FIXET,FIXET5.FIXET,ZDC,KBWI/10,JWALL-FIXET,FIXET5.MELTN,MELTN TRANSITION,JWALL BEWEE OHSSS CONLE FIXET JDUBB CASLY MELTN,KBWI/10 JWALL BEWEE OHSSS CONLE FIXET JDUBB CASLY MELTN
11/27/2025,FIXET,FIXET5.FIXET,ZDC,KBWI/15R,KEMMP-FIXET,FIXET5.MELTN,MELTN TRANSITION,KEMMP BEWEE OHSSS CONLE FIXET JDUBB CASLY MELTN,KBWI/15R KEMMP BEWEE OHSSS CONLE FIXET JDUBB CASLY MELTN
11/27/2025,FIXET,FIXET5.FIXET,ZDC,KBWI/33L|33R,SUGGS-FIXET,FIXET5.MELTN,MELTN TRANSITION,SUGGS STABL OHSSS CONLE FIXET JDUBB CASLY MELTN,KBWI/33L|33R SUGGS STABL OHSSS CONLE FIXET JDUBB CASLY MELTN
11/27/2025,FIXET,FIXET5.FIXET,ZDC,KBWI/28,BOSLY-FIXET,FIXET5.OTTTO,OTTTO TRANSITION,BOSLY SUGGS STABL OHSSS CONLE FIXET VERRY OTTTO,KBWI/28 BOSLY SUGGS STABL OHSSS CONLE FIXET VERRY OTTTO
11/27/2025,FIXET,FIXET5.FIXET,ZDC,KBWI/15L,GAGLR-FIXET,FIXET5.OTTTO,OTTTO TRANSITION,GAGLR BEWEE OHSSS CONLE FIXET VERRY OTTTO,KBWI/15L GAGLR BEWEE OHSSS CONLE FIXET VERRY OTTTO
11/27/2025,FIXET,FIXET5.FIXET,ZDC,KBWI/10,JWALL-FIXET,FIXET5.OTTTO,OTTTO TRANSITION,JWALL BEWEE OHSSS CONLE FIXET VERRY OTTTO,KBWI/10 JWALL BEWEE OHSSS CONLE FIXET VERRY OTTTO
11/27/2025,FIXET,FIXET5.FIXET,ZDC,KBWI/15R,KEMMP-FIXET,FIXET5.OTTTO,OTTTO TRANSITION,KEMMP BEWEE OHSSS CONLE FIXET VERRY OTTTO,KBWI/15R KEMMP BEWEE OHSSS CONLE FIXET VERRY OTTTO
11/27/2025,FIXET,FIXET5.FIXET,ZDC,KBWI/33L|33R,SUGGS-FIXET,FIXET5.OTTTO,OTTTO TRANSITION,SUGGS STABL OHSSS CONLE FIXET VERRY OTTTO,KBWI/33L|33R SUGGS STABL OHSSS CONLE FIXET VERRY OTTTO
11/27/2025,FIXET,FIXET5.FIXET,ZDC,KBWI/28,BOSLY-FIXET,FIXET5.RAMAY,RAMAY TRANSITION,BOSLY SUGGS STABL OHSSS CONLE FIXET VERRY RAMAY,KBWI/28 BOSLY SUGGS STABL OHSSS CONLE FIXET VERRY RAMAY
11/27/2025,FIXET,FIXET5.FIXET,ZDC,KBWI/15L,GAGLR-FIXET,FIXET5.RAMAY,RAMAY TRANSITION,GAGLR BEWEE OHSSS CONLE FIXET VERRY RAMAY,KBWI/15L GAGLR BEWEE OHSSS CONLE FIXET VERRY RAMAY
11/27/2025,FIXET,FIXET5.FIXET,ZDC,KBWI/10,JWALL-FIXET,FIXET5.RAMAY,RAMAY TRANSITION,JWALL BEWEE OHSSS CONLE FIXET VERRY RAMAY,KBWI/10 JWALL BEWEE OHSSS CONLE FIXET VERRY RAMAY
11/27/2025,FIXET,FIXET5.FIXET,ZDC,KBWI/15R,KEMMP-FIXET,FIXET5.RAMAY,RAMAY TRANSITION,KEMMP BEWEE OHSSS CONLE FIXET VERRY RAMAY,KBWI/15R KEMMP BEWEE OHSSS CONLE FIXET VERRY RAMAY
11/27/2025,FIXET,FIXET5.FIXET,ZDC,KBWI/33L|33R,SUGGS-FIXET,FIXET5.RAMAY,RAMAY TRANSITION,SUGGS STABL OHSSS CONLE FIXET VERRY RAMAY,KBWI/33L|33R SUGGS STABL OHSSS CONLE FIXET VERRY RAMAY
11/27/2025,FIXET,FIXET5.FIXET,ZDC,KBWI/28,BOSLY-FIXET,FIXET5.RRSIN,RRSIN TRANSITION,BOSLY SUGGS STABL OHSSS CONLE FIXET JDUBB TYPNZ SCORN RRSIN,KBWI/28 BOSLY SUGGS STABL OHSSS CONLE FIXET JDUBB TYPNZ SCORN RRSIN
11/27/2025,FIXET,FIXET5.FIXET,ZDC,KBWI/15L,GAGLR-FIXET,FIXET5.RRSIN,RRSIN TRANSITION,GAGLR BEWEE OHSSS CONLE FIXET JDUBB TYPNZ SCORN RRSIN,KBWI/15L GAGLR BEWEE OHSSS CONLE FIXET JDUBB TYPNZ SCORN RRSIN
11/27/2025,FIXET,FIXET5.FIXET,ZDC,KBWI/10,JWALL-FIXET,FIXET5.RRSIN,RRSIN TRANSITION,JWALL BEWEE OHSSS CONLE FIXET JDUBB TYPNZ SCORN RRSIN,KBWI/10 JWALL BEWEE OHSSS CONLE FIXET JDUBB TYPNZ SCORN RRSIN
11/27/2025,FIXET,FIXET5.FIXET,ZDC,KBWI/15R,KEMMP-FIXET,FIXET5.RRSIN,RRSIN TRANSITION,KEMMP BEWEE OHSSS CONLE FIXET JDUBB TYPNZ SCORN RRSIN,KBWI/15R KEMMP BEWEE OHSSS CONLE FIXET JDUBB TYPNZ SCORN RRSIN
11/27/2025,FIXET,FIXET5.FIXET,ZDC,KBWI/33L|33R,SUGGS-FIXET,FIXET5.RRSIN,RRSIN TRANSITION,SUGGS STABL OHSSS CONLE FIXET JDUBB TYPNZ SCORN RRSIN,KBWI/33L|33R SUGGS STABL OHSSS CONLE FIXET JDUBB TYPNZ SCORN RRSIN
11/27/2025,FLAME,FLAME4.FLAME,ZME,KBNA/20C|20L|20R,DIXII-FLAME,FLAME4.GENDE,GENDE TRANSITION,DIXII FLAME GENDE,KBNA/20C|20L|20R DIXII FLAME GENDE
11/27/2025,FLAME,FLAME4.FLAME,ZME,KBNA/13|31,FLAME,FLAME4.GENDE,GENDE TRANSITION,FLAME GENDE,KBNA/13|31 FLAME GENDE
11/27/2025,FLAME,FLAME4.FLAME,ZME,KBNA/02C|02L|02R,SHWIT-FLAME,FLAME4.GENDE,GENDE TRANSITION,SHWIT KKAYS TBUGG FLAME GENDE,KBNA/02C|02L|02R SHWIT KKAYS TBUGG FLAME GENDE
11/27/2025,FALCON,FLCON1.DRAKE,ZDV,KFLY/15|33,DRAKE,,,DRAKE,KFLY/15|33 DRAKE
11/27/2025,FLAGSTAFF,FLG1.OATES,ZAB,KFLG/03|21,OATES,,,OATES,KFLG/03|21 OATES
11/27/2025,FLIYN,FLIYN1.FLIYN,ZLC,KSUN/13,NOHVA-FLIYN,FLIYN1.GDWIN,GDWIN TRANSITION,NOHVA FLIYN GDWIN,KSUN/13 NOHVA FLIYN GDWIN
11/27/2025,FLIYN,FLIYN1.FLIYN,ZLC,KSUN/13,NOHVA-FLIYN,FLIYN1.JETZZ,JETZZ TRANSITION,NOHVA FLIYN PRVTE JETZZ,KSUN/13 NOHVA FLIYN PRVTE JETZZ
11/27/2025,FLIYN,FLIYN1.FLIYN,ZLC,KSUN/13,NOHVA-FLIYN,FLIYN1.KOURT,KOURT TRANSITION,NOHVA FLIYN PRVTE KOURT,KSUN/13 NOHVA FLIYN PRVTE KOURT
11/27/2025,FLIYN,FLIYN1.FLIYN,ZLC,KSUN/13,NOHVA-FLIYN,FLIYN1.LINNZ,LINNZ TRANSITION,NOHVA FLIYN KNDRA LINNZ,KSUN/13 NOHVA FLIYN KNDRA LINNZ
11/27/2025,FLMGO,FLMGO2.FLMGO,ZMA,KHST/06|24 KOPF/09L|09R|12|27L|27R|30 KTMB/09L|09R|13|27L|27R|31 X51/10|18|28|36,ALNZO-FLMGO,FLMGO2.STYMY,STYMY TRANSITION,ALNZO FLMGO WAPOM STYMY,KHST/06|24 KOPF/09L|09R|12|27L|27R|30 KTMB/09L|09R|13|27L|27R|31 X51/10|18|28|36 ALNZO FLMGO WAPOM STYMY
11/27/2025,FLMGO,FLMGO2.FLMGO,ZMA,KMIA/08L|08R|09|12,CSALT-FLMGO,FLMGO2.STYMY,STYMY TRANSITION,CSALT DEALZ LIIVV GEITH ALNZO FLMGO WAPOM STYMY,KMIA/08L|08R|09|12 CSALT DEALZ LIIVV GEITH ALNZO FLMGO WAPOM STYMY
11/27/2025,FLMGO,FLMGO2.FLMGO,ZMA,KMIA/26L|26R|27,KROCS-FLMGO,FLMGO2.STYMY,STYMY TRANSITION,KROCS RUSSS RMIRO ALNZO FLMGO WAPOM STYMY,KMIA/26L|26R|27 KROCS RUSSS RMIRO ALNZO FLMGO WAPOM STYMY
11/27/2025,FLMGO,FLMGO2.FLMGO,ZMA,KMIA/30,WADLE-FLMGO,FLMGO2.STYMY,STYMY TRANSITION,WADLE RMIRO ALNZO FLMGO WAPOM STYMY,KMIA/30 WADLE RMIRO ALNZO FLMGO WAPOM STYMY
11/27/2025,FLMGO,FLMGO2.FLMGO,ZMA,KHST/06|24 KOPF/09L|09R|12|27L|27R|30 KTMB/09L|09R|13|27L|27R|31 X51/10|18|28|36,ALNZO-FLMGO,FLMGO2.WAPOM,WAPOM TRANSITION,ALNZO FLMGO WAPOM,KHST/06|24 KOPF/09L|09R|12|27L|27R|30 KTMB/09L|09R|13|27L|27R|31 X51/10|18|28|36 ALNZO FLMGO WAPOM
11/27/2025,FLMGO,FLMGO2.FLMGO,ZMA,KMIA/08L|08R|09|12,CSALT-FLMGO,FLMGO2.WAPOM,WAPOM TRANSITION,CSALT DEALZ LIIVV GEITH ALNZO FLMGO WAPOM,KMIA/08L|08R|09|12 CSALT DEALZ LIIVV GEITH ALNZO FLMGO WAPOM
11/27/2025,FLMGO,FLMGO2.FLMGO,ZMA,KMIA/26L|26R|27,KROCS-FLMGO,FLMGO2.WAPOM,WAPOM TRANSITION,KROCS RUSSS RMIRO ALNZO FLMGO WAPOM,KMIA/26L|26R|27 KROCS RUSSS RMIRO ALNZO FLMGO WAPOM
11/27/2025,FLMGO,FLMGO2.FLMGO,ZMA,KMIA/30,WADLE-FLMGO,FLMGO2.WAPOM,WAPOM TRANSITION,WADLE RMIRO ALNZO FLMGO WAPOM,KMIA/30 WADLE RMIRO ALNZO FLMGO WAPOM
