EFF_DATE,DP_NAME,DP_COMPUTER_CODE,ARTCC,ORIG_GROUP,BODY_NAME,TRANSITION_COMPUTER_CODE,TRANSITION_NAME,ROUTE_POINTS,ROUTE_FROM_ORIG_GROUP
11/27/2025,READE,READE7.READE,ZDC,KRIC/02|16|20|34,CARML-READE,READE7.DRAIK,DRAIK TRANSITION,CARML READE DRAIK,KRIC/02|16|20|34 CARML READE DRAIK
11/27/2025,READE,READE7.READE,ZDC,KRIC/02|16|20|34,CARML-READE,READE7.LYH,LYNCHBURG TRANSITION,CARML READE LYH,KRIC/02|16|20|34 CARML READE LYH
11/27/2025,READE,READE7.READE,ZDC,KRIC/02|16|20|34,CARML-READE,READE7.MOL,MONTEBELLO TRANSITION,CARML READE MOL,KRIC/02|16|20|34 CARML READE MOL
11/27/2025,READE,READE7.READE,ZDC,KRIC/02|16|20|34,CARML-READE,READE7.SANNY,SANNY TRANSITION,CARML READE DRAIK SANNY,KRIC/02|16|20|34 CARML READE DRAIK SANNY
11/27/2025,REBLL,REBLL5.REBLL,ZDC,KDCA/15|19,CAPVC-REBLL,REBLL5.OTTTO,OTTTO TRANSITION,CAPVC GAITE LBOLT TEZER REBLL OTTTO,KDCA/15|19 CAPVC GAITE LBOLT TEZER REBLL OTTTO
11/27/2025,REBLL,REBLL5.REBLL,ZDC,KDCA/01|33,REVGE-REBLL,REBLL5.OTTTO,OTTTO TRANSITION,REVGE BEBLE RGIII CUKLI DUDDD REBLL OTTTO,KDCA/01|33 REVGE BEBLE RGIII CUKLI DUDDD REBLL OTTTO
11/27/2025,REGAE,REGAE2.REGAE,ZMA,KFLL/10R,CLPSO-REGAE,REGAE2.URSUS,URSUS TRANSITION,CLPSO CUDEL ZOMBI PASTL REGAE NINNO CRUZN GLAMS LRODD URSUS,KFLL/10R CLPSO CUDEL ZOMBI PASTL REGAE NINNO CRUZN GLAMS LRODD URSUS
11/27/2025,REGAE,REGAE2.REGAE,ZMA,KFLL/28L|28R,DREDS-REGAE,REGAE2.URSUS,URSUS TRANSITION,DREDS SHELZ JMACA BEEDZ LNKIN GTWAY PASTL REGAE NINNO CRUZN GLAMS LRODD URSUS,KFLL/28L|28R DREDS SHELZ JMACA BEEDZ LNKIN GTWAY PASTL REGAE NINNO CRUZN GLAMS LRODD URSUS
11/27/2025,REGAE,REGAE2.REGAE,ZMA,KFLL/10L,MRLEE-REGAE,REGAE2.URSUS,URSUS TRANSITION,MRLEE REELZ ZOMBI PASTL REGAE NINNO CRUZN GLAMS LRODD URSUS,KFLL/10L MRLEE REELZ ZOMBI PASTL REGAE NINNO CRUZN GLAMS LRODD URSUS
11/27/2025,RETYR,RETYR8.RETYR,ZHU,KHOU/04|13L|13R|22|31L|31R,RETYR-MNNKE,RETYR8.CRGER,CRGER TRANSITION,RETYR MNNKE ZUUUU PUFER PSTUR CRGER,KHOU/04|13L|13R|22|31L|31R RETYR MNNKE ZUUUU PUFER PSTUR CRGER
11/27/2025,RETYR,RETYR8.RETYR,ZHU,KHOU/04|13L|13R|22|31L|31R,RETYR-MNNKE,RETYR8.JCT,JUNCTION TRANSITION,RETYR MNNKE BOCCK MNURE HAYYY FOWLR JCT,KHOU/04|13L|13R|22|31L|31R RETYR MNNKE BOCCK MNURE HAYYY FOWLR JCT
11/27/2025,RETYR,RETYR8.RETYR,ZHU,KHOU/04|13L|13R|22|31L|31R,RETYR-MNNKE,RETYR8.MNURE,MNURE TRANSITION,RETYR MNNKE BOCCK MNURE,KHOU/04|13L|13R|22|31L|31R RETYR MNNKE BOCCK MNURE
11/27/2025,RETYR,RETYR8.RETYR,ZHU,KHOU/04|13L|13R|22|31L|31R,RETYR-MNNKE,RETYR8.SAT,SAN ANTONIO TRANSITION,RETYR MNNKE BOCCK MNURE MARCS SAT,KHOU/04|13L|13R|22|31L|31R RETYR MNNKE BOCCK MNURE MARCS SAT
11/27/2025,RETYR,RETYR8.RETYR,ZHU,KHOU/04|13L|13R|22|31L|31R,RETYR-MNNKE,RETYR8.WAILN,WAILN TRANSITION,RETYR MNNKE WEEED WAILN,KHOU/04|13L|13R|22|31L|31R RETYR MNNKE WEEED WAILN
11/27/2025,REVSS,REVSS6.REVSS,ZBW,KBOS/09,CLAWW-REVSS,,,CLAWW FENWY GLLET WYMTH DEDHM REVSS,KBOS/09 CLAWW FENWY GLLET WYMTH DEDHM REVSS
11/27/2025,REVSS,REVSS6.REVSS,ZBW,KBOS/27,KIRAA-REVSS,,,KIRAA GLOWB REVSS,KBOS/27 KIRAA GLOWB REVSS
11/27/2025,REVSS,REVSS6.REVSS,ZBW,KBOS/04R,NHANT-REVSS,,,NHANT HURBE ORRRR CHWDH STEEM DEDHM REVSS,KBOS/04R NHANT HURBE ORRRR CHWDH STEEM DEDHM REVSS
11/27/2025,REVSS,REVSS6.REVSS,ZBW,KBOS/15R,TASKT-REVSS,,,TASKT BRRRO JAITE HEWMO KENWI REVSS,KBOS/15R TASKT BRRRO JAITE HEWMO KENWI REVSS
11/27/2025,REVSS,REVSS6.REVSS,ZBW,KBOS/33L,TEKKK-REVSS,,,TEKKK DUBYU REVSS,KBOS/33L TEKKK DUBYU REVSS
11/27/2025,REVSS,REVSS6.REVSS,ZBW,KBOS/22L|22R,TJAYY-REVSS,,,TJAYY BRRRO JAITE HEWMO KENWI REVSS,KBOS/22L|22R TJAYY BRRRO JAITE HEWMO KENWI REVSS
11/27/2025,RHONE,RHONE3.RHONE,ZDV,KGJT/29,RHONE,RHONE3.JNC,GRAND JUNCTION TRANSITION,RHONE GIUBB JNC,KGJT/29 RHONE GIUBB JNC
11/27/2025,RHONE,RHONE3.RHONE,ZDV,KGJT/29,RHONE,RHONE3.TESSY,TESSY TRANSITION,RHONE LOMMA TESSY,KGJT/29 RHONE LOMMA TESSY
11/27/2025,RICHE,RICHE3.BOOKE,ZHN,PHLI/17|21,BOOKE,,,BOOKE,PHLI/17|21 BOOKE
11/27/2025,RICHY,RICHY7.SWR,ZOA,KTVL/36,SWR-RICHY,RICHY7.GENNE,GENNE TRANSITION,SWR RICHY MARRI GENNE,KTVL/36 SWR RICHY MARRI GENNE
11/27/2025,RICHY,RICHY7.SWR,ZOA,KTVL/36,SWR-RICHY,RICHY7.MARRI,MARRI TRANSITION,SWR RICHY MARRI,KTVL/36 SWR RICHY MARRI
11/27/2025,RICHY,RICHY7.SWR,ZOA,KTVL/36,SWR-RICHY,RICHY7.SPOOK,SPOOK TRANSITION,SWR RICHY SPOOK,KTVL/36 SWR RICHY SPOOK
11/27/2025,RICHY,RICHY7.SWR,ZOA,KTVL/36,SWR-RICHY,RICHY7.TILTS,TILTS TRANSITION,SWR RICHY MARRI TILTS,KTVL/36 SWR RICHY MARRI TILTS
11/27/2025,RIDDG,RIDDG2.RIDDG,ZLC,KGPI/20,DAACE-RIDDG,RIDDG2.MLP,MULLAN PASS TRANSITION,DAACE PYGMY RIDDG MLP,KGPI/20 DAACE PYGMY RIDDG MLP
11/27/2025,RIDDG,RIDDG2.RIDDG,ZLC,KGPI/02,KECEK-RIDDG,RIDDG2.MLP,MULLAN PASS TRANSITION,KECEK EEVEL KNEVL RIDDG MLP,KGPI/02 KECEK EEVEL KNEVL RIDDG MLP
11/27/2025,RIDDG,RIDDG2.RIDDG,ZLC,KGPI/20,DAACE-RIDDG,RIDDG2.MSO,MISSOULA TRANSITION,DAACE PYGMY RIDDG MSO,KGPI/20 DAACE PYGMY RIDDG MSO
11/27/2025,RIDDG,RIDDG2.RIDDG,ZLC,KGPI/02,KECEK-RIDDG,RIDDG2.MSO,MISSOULA TRANSITION,KECEK EEVEL KNEVL RIDDG MSO,KGPI/02 KECEK EEVEL KNEVL RIDDG MSO
11/27/2025,RIDDG,RIDDG2.RIDDG,ZLC,KGPI/20,DAACE-RIDDG,RIDDG2.SKOTT,SKOTT TRANSITION,DAACE PYGMY RIDDG DRDVL SKOTT,KGPI/20 DAACE PYGMY RIDDG DRDVL SKOTT
11/27/2025,RIDDG,RIDDG2.RIDDG,ZLC,KGPI/02,KECEK-RIDDG,RIDDG2.SKOTT,SKOTT TRANSITION,KECEK EEVEL KNEVL RIDDG DRDVL SKOTT,KGPI/02 KECEK EEVEL KNEVL RIDDG DRDVL SKOTT
11/27/2025,RICHFIELD,RIF2.RIF,ZLC,KRIF/01,FABRI-DTA,,,FABRI GILEY CHMIO DTA,KRIF/01 FABRI GILEY CHMIO DTA
11/27/2025,RITAA,RITAA7.RITAA,ZHU,KIAH/08L|08R|09|26L|26R|27|33L|33R,BOTLL-RITAA,RITAA7.CRP,CORPUS CHRISTI TRANSITION,BOTLL FLYZA WINEO RITAA SKUBA PSX YOMOM CRP,KIAH/08L|08R|09|26L|26R|27|33L|33R BOTLL FLYZA WINEO RITAA SKUBA PSX YOMOM CRP
11/27/2025,RITAA,RITAA7.RITAA,ZHU,KIAH/15L|15R,TTAPS-RITAA,RITAA7.CRP,CORPUS CHRISTI TRANSITION,TTAPS BOTLL FLYZA WINEO RITAA SKUBA PSX YOMOM CRP,KIAH/15L|15R TTAPS BOTLL FLYZA WINEO RITAA SKUBA PSX YOMOM CRP
11/27/2025,RITAA,RITAA7.RITAA,ZHU,KIAH/08L|08R|09|26L|26R|27|33L|33R,BOTLL-RITAA,RITAA7.NGP,TRUAX TRANSITION,BOTLL FLYZA WINEO RITAA RIIGG NGP,KIAH/08L|08R|09|26L|26R|27|33L|33R BOTLL FLYZA WINEO RITAA RIIGG NGP
11/27/2025,RITAA,RITAA7.RITAA,ZHU,KIAH/15L|15R,TTAPS-RITAA,RITAA7.NGP,TRUAX TRANSITION,TTAPS BOTLL FLYZA WINEO RITAA RIIGG NGP,KIAH/15L|15R TTAPS BOTLL FLYZA WINEO RITAA RIIGG NGP
11/27/2025,RITAA,RITAA7.RITAA,ZHU,KIAH/08L|08R|09|26L|26R|27|33L|33R,BOTLL-RITAA,RITAA7.PSX,PALACIOS TRANSITION,BOTLL FLYZA WINEO RITAA SKUBA PSX,KIAH/08L|08R|09|26L|26R|27|33L|33R BOTLL FLYZA WINEO RITAA SKUBA PSX
11/27/2025,RITAA,RITAA7.RITAA,ZHU,KIAH/15L|15R,TTAPS-RITAA,RITAA7.PSX,PALACIOS TRANSITION,TTAPS BOTLL FLYZA WINEO RITAA SKUBA PSX,KIAH/15L|15R TTAPS BOTLL FLYZA WINEO RITAA SKUBA PSX
11/27/2025,RITAA,RITAA7.RITAA,ZHU,KIAH/08L|08R|09|26L|26R|27|33L|33R,BOTLL-RITAA,RITAA7.WWREN,WWREN TRANSITION,BOTLL FLYZA WINEO RITAA RIIGG WWREN,KIAH/08L|08R|09|26L|26R|27|33L|33R BOTLL FLYZA WINEO RITAA RIIGG WWREN
11/27/2025,RITAA,RITAA7.RITAA,ZHU,KIAH/15L|15R,TTAPS-RITAA,RITAA7.WWREN,WWREN TRANSITION,TTAPS BOTLL FLYZA WINEO RITAA RIIGG WWREN,KIAH/15L|15R TTAPS BOTLL FLYZA WINEO RITAA RIIGG WWREN
11/27/2025,RITAA,RITAA7.RITAA,ZHU,KIAH/08L|08R|09|26L|26R|27|33L|33R,BOTLL-RITAA,RITAA7.YOMOM,YOMOM TRANSITION,BOTLL FLYZA WINEO RITAA SKUBA PSX YOMOM,KIAH/08L|08R|09|26L|26R|27|33L|33R BOTLL FLYZA WINEO RITAA SKUBA PSX YOMOM
11/27/2025,RITAA,RITAA7.RITAA,ZHU,KIAH/15L|15R,TTAPS-RITAA,RITAA7.YOMOM,YOMOM TRANSITION,TTAPS BOTLL FLYZA WINEO RITAA SKUBA PSX YOMOM,KIAH/15L|15R TTAPS BOTLL FLYZA WINEO RITAA SKUBA PSX YOMOM
11/27/2025,RNLDI,RNLDI4.RNLDI,ZDC,KIAD/01C|01L|01R|30,LOULU-RNLDI,RNLDI4.OTTTO,OTTTO TRANSITION,LOULU RNLDI OTTTO,KIAD/01C|01L|01R|30 LOULU RNLDI OTTTO
11/27/2025,RNLDI,RNLDI4.RNLDI,ZDC,KIAD/19C|19L|19R,TIICE-RNLDI,RNLDI4.OTTTO,OTTTO TRANSITION,TIICE WHYUU RNLDI OTTTO,KIAD/19C|19L|19R TIICE WHYUU RNLDI OTTTO
11/27/2025,ROCKT,ROCKT4.ROCKT,ZID,KCVG/27,BONLE-ROCKT,ROCKT4.AHTIY,AHTIY TRANSITION,BONLE DBEAR JLINC WADAL FARUM CIVLO ROCKT CADRE AHTIY,KCVG/27 BONLE DBEAR JLINC WADAL FARUM CIVLO ROCKT CADRE AHTIY
11/27/2025,ROCKT,ROCKT4.ROCKT,ZID,KCVG/18R,FANSA-ROCKT,ROCKT4.AHTIY,AHTIY TRANSITION,FANSA HIPAS JABDU SLUBY MOIER WADAL FARUM CIVLO ROCKT CADRE AHTIY,KCVG/18R FANSA HIPAS JABDU SLUBY MOIER WADAL FARUM CIVLO ROCKT CADRE AHTIY
11/27/2025,ROCKT,ROCKT4.ROCKT,ZID,KCVG/18C,FLOEE-ROCKT,ROCKT4.AHTIY,AHTIY TRANSITION,FLOEE CODKO SLUBY MOIER WADAL FARUM CIVLO ROCKT CADRE AHTIY,KCVG/18C FLOEE CODKO SLUBY MOIER WADAL FARUM CIVLO ROCKT CADRE AHTIY
11/27/2025,ROCKT,ROCKT4.ROCKT,ZID,KCVG/36R,HAGSS-ROCKT,ROCKT4.AHTIY,AHTIY TRANSITION,HAGSS HOMIX CERPO WADAL FARUM CIVLO ROCKT CADRE AHTIY,KCVG/36R HAGSS HOMIX CERPO WADAL FARUM CIVLO ROCKT CADRE AHTIY
11/27/2025,ROCKT,ROCKT4.ROCKT,ZID,KCVG/09,KINNG-ROCKT,ROCKT4.AHTIY,AHTIY TRANSITION,KINNG CERPO WADAL FARUM CIVLO ROCKT CADRE AHTIY,KCVG/09 KINNG CERPO WADAL FARUM CIVLO ROCKT CADRE AHTIY
11/27/2025,ROCKT,ROCKT4.ROCKT,ZID,KCVG/18L,LASNG-ROCKT,ROCKT4.AHTIY,AHTIY TRANSITION,LASNG CODKO SLUBY MOIER WADAL FARUM CIVLO ROCKT CADRE AHTIY,KCVG/18L LASNG CODKO SLUBY MOIER WADAL FARUM CIVLO ROCKT CADRE AHTIY
11/27/2025,ROCKT,ROCKT4.ROCKT,ZID,KCVG/36C|36L,RORFE-ROCKT,ROCKT4.AHTIY,AHTIY TRANSITION,RORFE SUVBE HOMIX CERPO WADAL FARUM CIVLO ROCKT CADRE AHTIY,KCVG/36C|36L RORFE SUVBE HOMIX CERPO WADAL FARUM CIVLO ROCKT CADRE AHTIY
11/27/2025,ROCKT,ROCKT4.ROCKT,ZID,KCVG/27,BONLE-ROCKT,ROCKT4.ARRAY,ARRAY TRANSITION,BONLE DBEAR JLINC WADAL FARUM CIVLO ROCKT ARRAY,KCVG/27 BONLE DBEAR JLINC WADAL FARUM CIVLO ROCKT ARRAY
11/27/2025,ROCKT,ROCKT4.ROCKT,ZID,KCVG/18R,FANSA-ROCKT,ROCKT4.ARRAY,ARRAY TRANSITION,FANSA HIPAS JABDU SLUBY MOIER WADAL FARUM CIVLO ROCKT ARRAY,KCVG/18R FANSA HIPAS JABDU SLUBY MOIER WADAL FARUM CIVLO ROCKT ARRAY
11/27/2025,ROCKT,ROCKT4.ROCKT,ZID,KCVG/18C,FLOEE-ROCKT,ROCKT4.ARRAY,ARRAY TRANSITION,FLOEE CODKO SLUBY MOIER WADAL FARUM CIVLO ROCKT ARRAY,KCVG/18C FLOEE CODKO SLUBY MOIER WADAL FARUM CIVLO ROCKT ARRAY
11/27/2025,ROCKT,ROCKT4.ROCKT,ZID,KCVG/36R,HAGSS-ROCKT,ROCKT4.ARRAY,ARRAY TRANSITION,HAGSS HOMIX CERPO WADAL FARUM CIVLO ROCKT ARRAY,KCVG/36R HAGSS HOMIX CERPO WADAL FARUM CIVLO ROCKT ARRAY
11/27/2025,ROCKT,ROCKT4.ROCKT,ZID,KCVG/09,KINNG-ROCKT,ROCKT4.ARRAY,ARRAY TRANSITION,KINNG CERPO WADAL FARUM CIVLO ROCKT ARRAY,KCVG/09 KINNG CERPO WADAL FARUM CIVLO ROCKT ARRAY
11/27/2025,ROCKT,ROCKT4.ROCKT,ZID,KCVG/18L,LASNG-ROCKT,ROCKT4.ARRAY,ARRAY TRANSITION,LASNG CODKO SLUBY MOIER WADAL FARUM CIVLO ROCKT ARRAY,KCVG/18L LASNG CODKO SLUBY MOIER WADAL FARUM CIVLO ROCKT ARRAY
11/27/2025,ROCKT,ROCKT4.ROCKT,ZID,KCVG/36C|36L,RORFE-ROCKT,ROCKT4.ARRAY,ARRAY TRANSITION,RORFE SUVBE HOMIX CERPO WADAL FARUM CIVLO ROCKT ARRAY,KCVG/36C|36L RORFE SUVBE HOMIX CERPO WADAL FARUM CIVLO ROCKT ARRAY
11/27/2025,ROCKY,ROCKY1.ROCKY,ZID,KEYE/03|21 KGEZ KHFY/01 KIND/05R|23L|23R KMQJ/25 KTYQ KUMP/33,TTH-ROCKY,ROCKY1.SPI,SPINNER TRANSITION,TTH ROCKY SPI,KEYE/03|21 KGEZ KHFY/01 KIND/05R|23L|23R KMQJ/25 KTYQ KUMP/33 TTH ROCKY SPI
11/27/2025,ROCKY,ROCKY1.ROCKY,ZID,KEYE/03|21 KGEZ KHFY/01 KIND/05R|23L|23R KMQJ/25 KTYQ KUMP/33,TTH-ROCKY,ROCKY1.STL,ST. LOUIS TRANSITION,TTH ROCKY STL,KEYE/03|21 KGEZ KHFY/01 KIND/05R|23L|23R KMQJ/25 KTYQ KUMP/33 TTH ROCKY STL
11/27/2025,RONAN,RONAN3.ANGIL,ZLC,7S0/34,CIMRI-ANGIL,,,CIMRI TEPSE ANGIL,7S0/34 CIMRI TEPSE ANGIL
11/27/2025,RONBE,RONBE2.RONBE,ZDV,KANK/24,UHIKI-RONBE,,,UHIKI RONBE,KANK/24 UHIKI RONBE
11/27/2025,RONHU,RONHU2.RONHU,ZOA,KUKI/33,RONHU,RONHU2.ENI,MENDOCINO TRANSITION,RONHU TRSAK URYKA ENI,KUKI/33 RONHU TRSAK URYKA ENI
11/27/2025,RONHU,RONHU2.RONHU,ZOA,KUKI/33,RONHU,RONHU2.FLUEN,FLUEN TRANSITION,RONHU TRSAK FLUEN,KUKI/33 RONHU TRSAK FLUEN
11/27/2025,RONHU,RONHU2.RONHU,ZOA,KUKI/33,RONHU,RONHU2.LAPED,LAPED TRANSITION,RONHU WAGUP KAYAA LAPED,KUKI/33 RONHU WAGUP KAYAA LAPED
11/27/2025,RONHU,RONHU2.RONHU,ZOA,KUKI/33,RONHU,RONHU2.MENSE,MENSE TRANSITION,RONHU WAGUP MENSE,KUKI/33 RONHU WAGUP MENSE
11/27/2025,ROTRY,ROTRY6.ROTRY,ZKC,KSTL/29,DSAPP-ROTRY,ROTRY6.SKUTR,SKUTR TRANSITION,DSAPP ROTRY SKUTR,KSTL/29 DSAPP ROTRY SKUTR
11/27/2025,ROTRY,ROTRY6.ROTRY,ZKC,KSTL/11|12L|12R,FUNKE-ROTRY,ROTRY6.SKUTR,SKUTR TRANSITION,FUNKE BEART GMSKI ROTRY SKUTR,KSTL/11|12L|12R FUNKE BEART GMSKI ROTRY SKUTR
11/27/2025,ROTRY,ROTRY6.ROTRY,ZKC,KSTL/30L|30R,WOLTR-ROTRY,ROTRY6.SKUTR,SKUTR TRANSITION,WOLTR ROTRY SKUTR,KSTL/30L|30R WOLTR ROTRY SKUTR
11/27/2025,ROWEY,ROWEY1.ROWEY,ZLC,KDUB/11,ROWEY,,,ROWEY,KDUB/11 ROWEY
11/27/2025,ROYES,ROYES7.ROYES,ZJX,KDAB/07L|07R|16|25L|25R|34,CRG,,,CRG,KDAB/07L|07R|16|25L|25R|34 CRG
11/27/2025,ROZBO,ROZBO5.ROZBO,ZDC,KRDU/05L|05R|14|23L|23R|32,EAGER-ROZBO,,,EAGER ROZBO,KRDU/05L|05R|14|23L|23R|32 EAGER ROZBO
11/27/2025,RREHD,RREHD1.RREHD,ZOA,KSTS/02|32,MMOLL-RREHD,RREHD1.HADLY,HADLY TRANSITION,MMOLL RREHD BAYRN HADLY,KSTS/02|32 MMOLL RREHD BAYRN HADLY
11/27/2025,RREHD,RREHD1.RREHD,ZOA,KSTS/14|20,RREHD,RREHD1.HADLY,HADLY TRANSITION,RREHD BAYRN HADLY,KSTS/14|20 RREHD BAYRN HADLY
11/27/2025,RREHD,RREHD1.RREHD,ZOA,KSTS/02|32,MMOLL-RREHD,RREHD1.NTELL,NTELL TRANSITION,MMOLL RREHD BAYRN HADLY JRICE NTELL,KSTS/02|32 MMOLL RREHD BAYRN HADLY JRICE NTELL
11/27/2025,RREHD,RREHD1.RREHD,ZOA,KSTS/14|20,RREHD,RREHD1.NTELL,NTELL TRANSITION,RREHD BAYRN HADLY JRICE NTELL,KSTS/14|20 RREHD BAYRN HADLY JRICE NTELL
11/27/2025,ROSCOE,RSCO4.VVERA,ZLA,KVNY/16R,DSSRT-VVERA,RSCO4.DAG,DAGGETT TRANSITION,DSSRT BSHOW CCHUM KIMMO SLAPP JARZO VVERA SSETH DAG,KVNY/16R DSSRT BSHOW CCHUM KIMMO SLAPP JARZO VVERA SSETH DAG
11/27/2025,ROSCOE,RSCO4.VVERA,ZLA,KVNY/16R,DSSRT-VVERA,RSCO4.HEC,HECTOR TRANSITION,DSSRT BSHOW CCHUM KIMMO SLAPP JARZO VVERA SSETH HEC,KVNY/16R DSSRT BSHOW CCHUM KIMMO SLAPP JARZO VVERA SSETH HEC
11/27/2025,ROCHESTER,RST1.RST,ZMP,KANE KFCM KMSP/04|12L|12R|17|22|30L|30R|35 KSTP/09|13|14|27|32,FGT-RST,RST1.ALO,WATERLOO TRANSITION,FGT FOBUG DOKTR CORDY RST ALO,KANE KFCM KMSP/04|12L|12R|17|22|30L|30R|35 KSTP/09|13|14|27|32 FGT FOBUG DOKTR CORDY RST ALO
11/27/2025,RUGGD,RUGGD3.RUGGD,ZLC,KSLC/16L|16R|17|34L|34R|35,BUBBY-RUGGD,RUGGD3.EKR,MEEKER TRANSITION,BUBBY RUGGD UPJAR BORZI EKR,KSLC/16L|16R|17|34L|34R|35 BUBBY RUGGD UPJAR BORZI EKR
11/27/2025,RUGGD,RUGGD3.RUGGD,ZLC,KSLC/16L|16R|17|34L|34R|35,BUBBY-RUGGD,RUGGD3.HOLTR,HOLTR TRANSITION,BUBBY RUGGD KLOUD SAWGI HOLTR,KSLC/16L|16R|17|34L|34R|35 BUBBY RUGGD KLOUD SAWGI HOLTR
11/27/2025,RUGGD,RUGGD3.RUGGD,ZLC,KSLC/16L|16R|17|34L|34R|35,BUBBY-RUGGD,RUGGD3.KIERA,KIERA TRANSITION,BUBBY RUGGD LOFOG LEGBE KIERA,KSLC/16L|16R|17|34L|34R|35 BUBBY RUGGD LOFOG LEGBE KIERA
11/27/2025,RUGGD,RUGGD3.RUGGD,ZLC,KSLC/16L|16R|17|34L|34R|35,BUBBY-RUGGD,RUGGD3.OCS,ROCK SPRINGS TRANSITION,BUBBY RUGGD SPINE SKIII POPLE OCS,KSLC/16L|16R|17|34L|34R|35 BUBBY RUGGD SPINE SKIII POPLE OCS
11/27/2025,RUGGD,RUGGD3.RUGGD,ZLC,KSLC/16L|16R|17|34L|34R|35,BUBBY-RUGGD,RUGGD3.PERTY,PERTY TRANSITION,BUBBY RUGGD HERTS PERTY,KSLC/16L|16R|17|34L|34R|35 BUBBY RUGGD HERTS PERTY
11/27/2025,BRIDGES,RVF2.HIA,ZLC,KRVF/35,HIA,,,HIA,KRVF/35 HIA
11/27/2025,RVRCT,RVRCT4.RVRCT,ZOA,KSMF/35L|35R,RVRCT,RVRCT4.MACUS,MACUS TRANSITION,RVRCT DNGER MACUS,KSMF/35L|35R RVRCT DNGER MACUS
11/27/2025,RVRCT,RVRCT4.RVRCT,ZOA,KSMF/35L|35R,RVRCT,RVRCT4.RALEY,RALEY TRANSITION,RVRCT DNGER RALEY,KSMF/35L|35R RVRCT DNGER RALEY
11/27/2025,RVRCT,RVRCT4.RVRCT,ZOA,KSMF/35L|35R,RVRCT,RVRCT4.SHUFL,SHUFL TRANSITION,RVRCT DOSCO DUNGN DRAGN SHUFL,KSMF/35L|35R RVRCT DOSCO DUNGN DRAGN SHUFL
11/27/2025,RYPAX,RYPAX2.RYPAX,ZOA,KUKI/15,RYPAX,RYPAX2.GETER,GETER TRANSITION,RYPAX GETER,KUKI/15 RYPAX GETER
11/27/2025,RYPAX,RYPAX2.RYPAX,ZOA,KUKI/15,RYPAX,RYPAX2.LAPED,LAPED TRANSITION,RYPAX LAPED,KUKI/15 RYPAX LAPED
11/27/2025,RYPAX,RYPAX2.RYPAX,ZOA,KUKI/15,RYPAX,RYPAX2.MERRI,MERRI TRANSITION,RYPAX LAMSN LUCRN MERRI,KUKI/15 RYPAX LAMSN LUCRN MERRI
11/27/2025,RYPAX,RYPAX2.RYPAX,ZOA,KUKI/15,RYPAX,RYPAX2.SABBY,SABBY TRANSITION,RYPAX LAMSN SABBY,KUKI/15 RYPAX LAMSN SABBY
11/27/2025,SABTH,SABTH2.SABTH,ZDV,KDEN/16L|16R|17R,BOGEI-SABTH,SABTH2.JOPLN,JOPLN TRANSITION,BOGEI JSMNN SHOJO SABTH JOPLN,KDEN/16L|16R|17R BOGEI JSMNN SHOJO SABTH JOPLN
11/27/2025,SABTH,SABTH2.SABTH,ZDV,KDEN/25,BRKEM-SABTH,SABTH2.JOPLN,JOPLN TRANSITION,BRKEM LENNN TIKLR CIROS ICECI SHOJO SABTH JOPLN,KDEN/25 BRKEM LENNN TIKLR CIROS ICECI SHOJO SABTH JOPLN
11/27/2025,SABTH,SABTH2.SABTH,ZDV,KDEN/08,KIDNG-SABTH,SABTH2.JOPLN,JOPLN TRANSITION,KIDNG TWWIN FIGTR PACMN SHOJO SABTH JOPLN,KDEN/08 KIDNG TWWIN FIGTR PACMN SHOJO SABTH JOPLN
11/27/2025,SABTH,SABTH2.SABTH,ZDV,KDEN/17L,RAYDR-SABTH,SABTH2.JOPLN,JOPLN TRANSITION,RAYDR JSMNN SHOJO SABTH JOPLN,KDEN/17L RAYDR JSMNN SHOJO SABTH JOPLN
11/27/2025,SABTH,SABTH2.SABTH,ZDV,KDEN/34L|34R|35L|35R,SHOJO-SABTH,SABTH2.JOPLN,JOPLN TRANSITION,SHOJO SABTH JOPLN,KDEN/34L|34R|35L|35R SHOJO SABTH JOPLN
11/27/2025,SABTH,SABTH2.SABTH,ZDV,KDEN/16L|16R|17R,BOGEI-SABTH,SABTH2.VRONI,VRONI TRANSITION,BOGEI JSMNN SHOJO SABTH VRONI,KDEN/16L|16R|17R BOGEI JSMNN SHOJO SABTH VRONI
11/27/2025,SABTH,SABTH2.SABTH,ZDV,KDEN/25,BRKEM-SABTH,SABTH2.VRONI,VRONI TRANSITION,BRKEM LENNN TIKLR CIROS ICECI SHOJO SABTH VRONI,KDEN/25 BRKEM LENNN TIKLR CIROS ICECI SHOJO SABTH VRONI
11/27/2025,SABTH,SABTH2.SABTH,ZDV,KDEN/08,KIDNG-SABTH,SABTH2.VRONI,VRONI TRANSITION,KIDNG TWWIN FIGTR PACMN SHOJO SABTH VRONI,KDEN/08 KIDNG TWWIN FIGTR PACMN SHOJO SABTH VRONI
11/27/2025,SABTH,SABTH2.SABTH,ZDV,KDEN/17L,RAYDR-SABTH,SABTH2.VRONI,VRONI TRANSITION,RAYDR JSMNN SHOJO SABTH VRONI,KDEN/17L RAYDR JSMNN SHOJO SABTH VRONI
11/27/2025,SABTH,SABTH2.SABTH,ZDV,KDEN/34L|34R|35L|35R,SHOJO-SABTH,SABTH2.VRONI,VRONI TRANSITION,SHOJO SABTH VRONI,KDEN/34L|34R|35L|35R SHOJO SABTH VRONI
11/27/2025,SACAT,SACAT3.SACAT,ZAB,KFFZ/22L,EHISO-SACAT,,,EHISO SACAT,KFFZ/22L EHISO SACAT
11/27/2025,SACAT,SACAT3.SACAT,ZAB,KFFZ/22R,FEVTI-SACAT,,,FEVTI SACAT,KFFZ/22R FEVTI SACAT
11/27/2025,SACAT,SACAT3.SACAT,ZAB,KFFZ/04L|04R,SACAT,,,SACAT,KFFZ/04L|04R SACAT
11/27/2025,SAFFORD,SAFRD1.SAFRD,ZAB,KSAD/12,XOMZA-SSO,,,XOMZA SSO,KSAD/12 XOMZA SSO
11/27/2025,SAFFORD,SAFRD1.SAFRD,ZAB,KSAD/30,ZULOM-SSO,,,ZULOM SEBOC SSO,KSAD/30 ZULOM SEBOC SSO
11/27/2025,SAHEY,SAHEY4.SAHEY,ZOA,KSFO/10L,ORYAN-SAHEY,SAHEY4.KAYEX,KAYEX TRANSITION,ORYAN SAHEY MAAYS MCOVY KAYEX,KSFO/10L ORYAN SAHEY MAAYS MCOVY KAYEX
11/27/2025,SAHEY,SAHEY4.SAHEY,ZOA,KSFO/19L|19R,SAHEY,SAHEY4.KAYEX,KAYEX TRANSITION,SAHEY MAAYS MCOVY KAYEX,KSFO/19L|19R SAHEY MAAYS MCOVY KAYEX
11/27/2025,SAHEY,SAHEY4.SAHEY,ZOA,KSFO/10R,URRSA-SAHEY,SAHEY4.KAYEX,KAYEX TRANSITION,URRSA SAHEY MAAYS MCOVY KAYEX,KSFO/10R URRSA SAHEY MAAYS MCOVY KAYEX
11/27/2025,SAHEY,SAHEY4.SAHEY,ZOA,KSFO/10L,ORYAN-SAHEY,SAHEY4.KTINA,KTINA TRANSITION,ORYAN SAHEY MAAYS MCOVY KTINA,KSFO/10L ORYAN SAHEY MAAYS MCOVY KTINA
11/27/2025,SAHEY,SAHEY4.SAHEY,ZOA,KSFO/19L|19R,SAHEY,SAHEY4.KTINA,KTINA TRANSITION,SAHEY MAAYS MCOVY KTINA,KSFO/19L|19R SAHEY MAAYS MCOVY KTINA
11/27/2025,SAHEY,SAHEY4.SAHEY,ZOA,KSFO/10R,URRSA-SAHEY,SAHEY4.KTINA,KTINA TRANSITION,URRSA SAHEY MAAYS MCOVY KTINA,KSFO/10R URRSA SAHEY MAAYS MCOVY KTINA
11/27/2025,SAHEY,SAHEY4.SAHEY,ZOA,KSFO/10L,ORYAN-SAHEY,SAHEY4.NTELL,NTELL TRANSITION,ORYAN SAHEY CIITY HOPII NTELL,KSFO/10L ORYAN SAHEY CIITY HOPII NTELL
11/27/2025,SAHEY,SAHEY4.SAHEY,ZOA,KSFO/19L|19R,SAHEY,SAHEY4.NTELL,NTELL TRANSITION,SAHEY CIITY HOPII NTELL,KSFO/19L|19R SAHEY CIITY HOPII NTELL
11/27/2025,SAHEY,SAHEY4.SAHEY,ZOA,KSFO/10R,URRSA-SAHEY,SAHEY4.NTELL,NTELL TRANSITION,URRSA SAHEY CIITY HOPII NTELL,KSFO/10R URRSA SAHEY CIITY HOPII NTELL
11/27/2025,SAHEY,SAHEY4.SAHEY,ZOA,KSFO/10L,ORYAN-SAHEY,SAHEY4.SUSEY,SUSEY TRANSITION,ORYAN SAHEY MAAYS MCOVY SUSEY,KSFO/10L ORYAN SAHEY MAAYS MCOVY SUSEY
11/27/2025,SAHEY,SAHEY4.SAHEY,ZOA,KSFO/19L|19R,SAHEY,SAHEY4.SUSEY,SUSEY TRANSITION,SAHEY MAAYS MCOVY SUSEY,KSFO/19L|19R SAHEY MAAYS MCOVY SUSEY
11/27/2025,SAHEY,SAHEY4.SAHEY,ZOA,KSFO/10R,URRSA-SAHEY,SAHEY4.SUSEY,SUSEY TRANSITION,URRSA SAHEY MAAYS MCOVY SUSEY,KSFO/10R URRSA SAHEY MAAYS MCOVY SUSEY
11/27/2025,SALAD,SALAD5.SALAD,ZOA,KOAK/28L|28R,SALAD,SALAD5.ALTAM,ALTAM TRANSITION,SALAD ALTAM,KOAK/28L|28R SALAD ALTAM
11/27/2025,SAMMI,SAMMI4.SAMMI,ZTL,KAGS/08|17|26|35 KAIK/01|07|19|25 KDNL/05|11|23|29 KHQU/10|28,TRPLE-SAMMI,,,TRPLE BOGII SAMMI,KAGS/08|17|26|35 KAIK/01|07|19|25 KDNL/05|11|23|29 KHQU/10|28 TRPLE BOGII SAMMI
11/27/2025,SARDD,SARDD3.LINDZ,ZDV,KASE/33,LINDZ,,,LINDZ,KASE/33 LINDZ
11/27/2025,SAWGY,SAWGY3.OMN,ZJX,KJAX,CRG-OMN,,,CRG SAWGY OMN,KJAX CRG SAWGY OMN
11/27/2025,SAYBR,SAYBR3.SAYBR,ZHU,3R9/16|34 KAUS/18L|18R|36L|36R KEDC/13|31 KGTU/11|18|29|36 KHYI/08|13|17|26|31|35 KRYW/15|33 T74/17|35,MUNCH-SAYBR,,,MUNCH SAYBR,3R9/16|34 KAUS/18L|18R|36L|36R KEDC/13|31 KGTU/11|18|29|36 KHYI/08|13|17|26|31|35 KRYW/15|33 T74/17|35 MUNCH SAYBR
11/27/2025,SAYOW,SAYOW2.SAYOW,ZLA,KSAN/09,SAYOW,SAYOW2.IPL,IMPERIAL TRANSITION,SAYOW CHRJR JUNOR IPL,KSAN/09 SAYOW CHRJR JUNOR IPL
11/27/2025,SAYOW,SAYOW2.SAYOW,ZLA,KSAN/09,SAYOW,SAYOW2.MTBAL,MTBAL TRANSITION,SAYOW LEGUE JLI NSHEE MTBAL,KSAN/09 SAYOW LEGUE JLI NSHEE MTBAL
11/27/2025,SBOAT,SBOAT1.SBOAT,ZMA,KLAL/10,WEMLA-SBOAT,,,WEMLA RAVME SBOAT,KLAL/10 WEMLA RAVME SBOAT
11/27/2025,SCAMR,SCAMR4.SCAMR,ZLA,KHND/17R,CAVER-SCAMR,SCAMR4.FRNCK,FRNCK TRANSITION,CAVER BOYTT ZIGLR SCAMR RATPK DARDN FRNCK,KHND/17R CAVER BOYTT ZIGLR SCAMR RATPK DARDN FRNCK
11/27/2025,SCAMR,SCAMR4.SCAMR,ZLA,KHND/35L,KITEE-SCAMR,SCAMR4.FRNCK,FRNCK TRANSITION,KITEE JAMIA SCAMR RATPK DARDN FRNCK,KHND/35L KITEE JAMIA SCAMR RATPK DARDN FRNCK
11/27/2025,SCAMR,SCAMR4.SCAMR,ZLA,KHND/17R,CAVER-SCAMR,SCAMR4.HOCEE,HOCEE TRANSITION,CAVER BOYTT ZIGLR SCAMR URSLA NIITZ HOCEE,KHND/17R CAVER BOYTT ZIGLR SCAMR URSLA NIITZ HOCEE
11/27/2025,SCAMR,SCAMR4.SCAMR,ZLA,KHND/35L,KITEE-SCAMR,SCAMR4.HOCEE,HOCEE TRANSITION,KITEE JAMIA SCAMR URSLA NIITZ HOCEE,KHND/35L KITEE JAMIA SCAMR URSLA NIITZ HOCEE
11/27/2025,SCAMR,SCAMR4.SCAMR,ZLA,KHND/17R,CAVER-SCAMR,SCAMR4.IWANS,IWANS TRANSITION,CAVER BOYTT ZIGLR SCAMR URSLA NIITZ IWANS,KHND/17R CAVER BOYTT ZIGLR SCAMR URSLA NIITZ IWANS
11/27/2025,SCAMR,SCAMR4.SCAMR,ZLA,KHND/35L,KITEE-SCAMR,SCAMR4.IWANS,IWANS TRANSITION,KITEE JAMIA SCAMR URSLA NIITZ IWANS,KHND/35L KITEE JAMIA SCAMR URSLA NIITZ IWANS
11/27/2025,SCAMR,SCAMR4.SCAMR,ZLA,KHND/17R,CAVER-SCAMR,SCAMR4.PGA,PAGE TRANSITION,CAVER BOYTT ZIGLR SCAMR URSLA NIITZ PGA,KHND/17R CAVER BOYTT ZIGLR SCAMR URSLA NIITZ PGA
11/27/2025,SCAMR,SCAMR4.SCAMR,ZLA,KHND/35L,KITEE-SCAMR,SCAMR4.PGA,PAGE TRANSITION,KITEE JAMIA SCAMR URSLA NIITZ PGA,KHND/35L KITEE JAMIA SCAMR URSLA NIITZ PGA
11/27/2025,SCAMR,SCAMR4.SCAMR,ZLA,KHND/17R,CAVER-SCAMR,SCAMR4.SSKEE,SSKEE TRANSITION,CAVER BOYTT ZIGLR SCAMR URSLA NIITZ IWANS SSKEE,KHND/17R CAVER BOYTT ZIGLR SCAMR URSLA NIITZ IWANS SSKEE
11/27/2025,SCAMR,SCAMR4.SCAMR,ZLA,KHND/35L,KITEE-SCAMR,SCAMR4.SSKEE,SSKEE TRANSITION,KITEE JAMIA SCAMR URSLA NIITZ IWANS SSKEE,KHND/35L KITEE JAMIA SCAMR URSLA NIITZ IWANS SSKEE
11/27/2025,SCAMR,SCAMR4.SCAMR,ZLA,KHND/17R,CAVER-SCAMR,SCAMR4.TUKRR,TUKRR TRANSITION,CAVER BOYTT ZIGLR SCAMR URSLA GIDGT NICLE TUKRR,KHND/17R CAVER BOYTT ZIGLR SCAMR URSLA GIDGT NICLE TUKRR
11/27/2025,SCAMR,SCAMR4.SCAMR,ZLA,KHND/35L,KITEE-SCAMR,SCAMR4.TUKRR,TUKRR TRANSITION,KITEE JAMIA SCAMR URSLA GIDGT NICLE TUKRR,KHND/35L KITEE JAMIA SCAMR URSLA GIDGT NICLE TUKRR
11/27/2025,SCAMR,SCAMR4.SCAMR,ZLA,KHND/17R,CAVER-SCAMR,SCAMR4.VERKN,VERKN TRANSITION,CAVER BOYTT ZIGLR SCAMR URSLA GIDGT GEEOO BETHL VERKN,KHND/17R CAVER BOYTT ZIGLR SCAMR URSLA GIDGT GEEOO BETHL VERKN
11/27/2025,SCAMR,SCAMR4.SCAMR,ZLA,KHND/35L,KITEE-SCAMR,SCAMR4.VERKN,VERKN TRANSITION,KITEE JAMIA SCAMR URSLA GIDGT GEEOO BETHL VERKN,KHND/35L KITEE JAMIA SCAMR URSLA GIDGT GEEOO BETHL VERKN
11/27/2025,SCAMR,SCAMR4.SCAMR,ZLA,KHND/17R,CAVER-SCAMR,SCAMR4.ZAYNE,ZAYNE TRANSITION,CAVER BOYTT ZIGLR SCAMR URSLA RASLR ROHCK ZAYNE,KHND/17R CAVER BOYTT ZIGLR SCAMR URSLA RASLR ROHCK ZAYNE
11/27/2025,SCAMR,SCAMR4.SCAMR,ZLA,KHND/35L,KITEE-SCAMR,SCAMR4.ZAYNE,ZAYNE TRANSITION,KITEE JAMIA SCAMR URSLA RASLR ROHCK ZAYNE,KHND/35L KITEE JAMIA SCAMR URSLA RASLR ROHCK ZAYNE
11/27/2025,SCAPO,SCAPO7.SCAPO,ZSE,KHIO/02|13L|13R|20|31L|31R,SCAPO,,,SCAPO,KHIO/02|13L|13R|20|31L|31R SCAPO
11/27/2025,SCHEP,SCHEP1.SCHEP,ZMP,KANE KFCM KMSP KSTP/09|13|14|27|32,SCHEP,SCHEP1.RXANN,RXANN TRANSITION,SCHEP RXANN,KANE KFCM KMSP KSTP/09|13|14|27|32 SCHEP RXANN
11/27/2025,SCOTTSDALE,SCOT7.SCOT,ZAB,KSDL/03|21,JONHH,SCOT7.ABQ,ALBUQUERQUE TRANSITION,JONHH FORPE IZTIR CHEKR SALTS WEKUM HOZER SJN PERRL ACOMA ABQ,KSDL/03|21 JONHH FORPE IZTIR CHEKR SALTS WEKUM HOZER SJN PERRL ACOMA ABQ
11/27/2025,SCOTTSDALE,SCOT7.SCOT,ZAB,KSDL/03|21,JONHH,SCOT7.BLH,BLYTHE TRANSITION,JONHH BXK VICKO SODSE JAROZ BLH,KSDL/03|21 JONHH BXK VICKO SODSE JAROZ BLH
11/27/2025,SCOTTSDALE,SCOT7.SCOT,ZAB,KSDL/03|21,JONHH,SCOT7.BXK,BUCKEYE TRANSITION,JONHH BXK,KSDL/03|21 JONHH BXK
11/27/2025,SCOTTSDALE,SCOT7.SCOT,ZAB,KSDL/03|21,JONHH,SCOT7.DINGO,DINGO TRANSITION,JONHH WINRR TFD BASER DINGO,KSDL/03|21 JONHH WINRR TFD BASER DINGO
11/27/2025,SCOTTSDALE,SCOT7.SCOT,ZAB,KSDL/03|21,JONHH,SCOT7.GBN,GILA BEND TRANSITION,JONHH MOBIE GBN,KSDL/03|21 JONHH MOBIE GBN
11/27/2025,SCOTTSDALE,SCOT7.SCOT,ZAB,KSDL/03|21,JONHH,SCOT7.OLIIN,OLIIN TRANSITION,JONHH WINRR TFD PUSCH OLIIN,KSDL/03|21 JONHH WINRR TFD PUSCH OLIIN
11/27/2025,SCOTTSDALE,SCOT7.SCOT,ZAB,KSDL/03|21,JONHH,SCOT7.TUS,TUCSON TRANSITION,JONHH WINRR TFD TUS,KSDL/03|21 JONHH WINRR TFD TUS
11/27/2025,SCRAM,SCRAM6.SCRAM,ZDC,KDCA/15|19,CAPVC-SCRAM,SCRAM6.GLANC,GLANC TRANSITION,CAPVC GAITE DMKRT POOCH SCRAM DANOO WALCE GLANC,KDCA/15|19 CAPVC GAITE DMKRT POOCH SCRAM DANOO WALCE GLANC
11/27/2025,SCRAM,SCRAM6.SCRAM,ZDC,KDAA KIAD/01C|01L|01R|19C|19L|19R|30 KJYO KMRB KOKV,POOCH-SCRAM,SCRAM6.GLANC,GLANC TRANSITION,POOCH SCRAM DANOO WALCE GLANC,KDAA KIAD/01C|01L|01R|19C|19L|19R|30 KJYO KMRB KOKV POOCH SCRAM DANOO WALCE GLANC
11/27/2025,SCRAM,SCRAM6.SCRAM,ZDC,KDCA/01|33,REVGE-SCRAM,SCRAM6.GLANC,GLANC TRANSITION,REVGE BEBLE RGIII CUKLI POOCH SCRAM DANOO WALCE GLANC,KDCA/01|33 REVGE BEBLE RGIII CUKLI POOCH SCRAM DANOO WALCE GLANC
11/27/2025,SCTWN,SCTWN4.SCTWN,ZOA,KSMF/17L|17R,SCTWN,SCTWN4.MACUS,MACUS TRANSITION,SCTWN DNGER MACUS,KSMF/17L|17R SCTWN DNGER MACUS
11/27/2025,SCTWN,SCTWN4.SCTWN,ZOA,KSMF/17L|17R,SCTWN,SCTWN4.RALEY,RALEY TRANSITION,SCTWN DNGER RALEY,KSMF/17L|17R SCTWN DNGER RALEY
11/27/2025,SCTWN,SCTWN4.SCTWN,ZOA,KSMF/17L|17R,SCTWN,SCTWN4.SHUFL,SHUFL TRANSITION,SCTWN DOSCO DUNGN DRAGN SHUFL,KSMF/17L|17R SCTWN DOSCO DUNGN DRAGN SHUFL
